,id,username,geo,created_at,date,tweet,language,hashtags,cashtags,link,urls,photos,video,thumbnail,nlikes,nreplies,nretweets
0,1.51e+18,RTKDrives,UK,1650000000000.0,2022-10-04T00:13:00Z,Blue BMW choice of the day:,en,[],[],https://twitter.com/RTKDrives/status/1512826091953692680,[],[],0, ,0,0,0
1,1.51e+18,danbucks80,Singapore,1650000000000.0,2022-10-04T00:05:00Z,"@BMW_SA ""Tired not driving BM'",en,[],[],https://twitter.com/danbucks80/status/1512823983380615172,[],[],0, ,0,0,0
2,1.51e+18,thegoogle93,India,1650000000000.0,2022-09-04T23:58:00Z,"The BMW car given to the employees by the IT company as a gift, the price of each car is one crore. The IT company gave BMW gifts to five employees who helped the company in difficult times  https://t.co/plnr50AMto",en,[],[],https://twitter.com/thegoogle93/status/1512822247572058113,['https://thegooglenews.in/2022/04/09/the-bmw-car-given-to-the-employees-by-the-it-company-as-a-gift-the-price-of-each-car-is-one-crore-the-it-company-gave-bmw-gifts-to-five-employees-who-helped-the-company-in-difficult-times/'],[],0, ,0,0,0
3,1.51e+18,ians_india,India,1650000000000.0,2022-09-04T23:54:00Z,"Two women were severely injured while three cars and two bikes damaged after the driver of a speeding BMW car in #Mangaluru on Saturday lost control and jumped the divider, ramming into vehicles coming from the opposite direction.  https://t.co/jppBRM6CWx",en,['mangaluru'],[],https://twitter.com/ians_india/status/1512821276842205185,[],[],1,https://pbs.twimg.com/ext_tw_video_thumb/1512821220043104259/pu/img/j-O4UdJ946Rh1hsN.jpg,2,0,0
4,1.51e+18,Andhravilasnews,USA,1650000000000.0,2022-09-04T23:48:00Z,"K'taka: 2 injured as BMW driver loses control, jumps divider  https://t.co/OQ2E1OzMSR #Indiafightscorona #Breakingnews #Indiapolitics #AndhraPolitics #NewsFeed #RadheShyam #KCR #YSJagan   Bengaluru, April 9 - Two women were severely injured while three cars and two bikes damage…",en,"['indiafightscorona', 'breakingnews', 'indiapolitics', 'andhrapolitics', 'newsfeed', 'radheshyam', 'kcr', 'ysjagan']",[],https://twitter.com/Andhravilasnews/status/1512819870903246850,['https://ift.tt/FHf9Lbw'],[],0, ,0,0,0
5,1.51e+18,Malik31Mahmoudi,USA,1650000000000.0,2022-09-04T23:45:00Z,"2022 BMW X3 Review, Pricing, and Specs  https://t.co/YzkoBMtQKp",en,[],[],https://twitter.com/Malik31Mahmoudi/status/1512818955475460101,['https://scrappinfreestyle.com/2022-bmw-x3-review-pricing-and-specs/'],[],0, ,0,0,0
6,1.51e+18,lzyontz,France,1650000000000.0,2022-09-04T23:42:00Z,@wahlstedt007 This goes a long way to describing BMW drivers…,en,[],[],https://twitter.com/lzyontz/status/1512818208004317186,[],[],0, ,0,0,0
7,1.51e+18,netamakerIndia,USA,1650000000000.0,2022-09-04T23:35:00Z,"Watch | Women Sustains Injuries After Speeding BMW Jumps Divider, Rams Into Her Scooty in Mangaluru  https://t.co/RPTTPw7ydN",en,[],[],https://twitter.com/netamakerIndia/status/1512816367736524803,['http://dlvr.it/SNGxjX'],[],0, ,0,0,0
8,1.51e+18,AarikiB,France,1650000000000.0,2022-09-04T23:31:00Z,"@Oneworldnews_ Fine the bmw owner 1 billion rs and the driver of the vehicle with life imprisonment. Also revoke the owner the rights to own aey please.ny business, house, vehicle, licence, ownership. Being rich does not mean they can do as th",en,[],[],https://twitter.com/AarikiB/status/1512815584022790144,[],[],0, ,2,0,1
9,1.51e+18,i3_i8Scarab,USA,1650000000000.0,2022-09-04T23:23:00Z,20k deposit now one of the three is fine We have 3 cars to pick from BMW i8 salvaged BMW i8 used or a black Tesla model 3 all in the same price range,en,[],[],https://twitter.com/i3_i8Scarab/status/1512813365814509574,[],[],0, ,1,0,0
10,1.51e+18,wrevoint,India,1650000000000.0,2022-09-04T23:22:00Z,"Watch | Women Sustains Injuries After Speeding BMW Jumps Divider, Rams Into Her Scooty in Mangaluru  https://t.co/6rsS6Hl0zA",en,[],[],https://twitter.com/wrevoint/status/1512813135161397251,['https://tifnews.com/world/india/watch-women-sustains-injuries-after-speeding-bmw-jumps-divider-rams-into-her-scooty-in-mangaluru/'],[],0, ,0,0,0
11,1.51e+18,alex_osman,France,1650000000000.0,2022-09-04T23:16:00Z,Frosty start this morning. . . #carroof #bmw #earlyriser #onlocation #dawn #shortfilm #fimmaking #photooftheday @ Bethnal Green  https://t.co/MtflrgsrG1,en,"['carroof', 'bmw', 'earlyriser', 'onlocation', 'dawn', 'shortfilm', 'fimmaking', 'photooftheday']",[],https://twitter.com/alex_osman/status/1512811814920327169,['https://www.instagram.com/p/CcIpBGCqFuj/?igshid=YTgzYjQ4ZTY='],[],0, ,0,0,0
12,1.51e+18,schrippenkarl,France,1650000000000.0,2022-09-04T23:15:00Z,@HerrBonden What’s going on here @BMW ?,en,[],[],https://twitter.com/schrippenkarl/status/1512811485726187529,[],[],0, ,0,0,0
13,1.51e+18,Marshall_BMW,France,1650000000000.0,2022-09-04T22:59:00Z,Mr &amp; Mrs Patel collecting their stunning new X3 from Joe Collier at Marshall #BMW #Salisbury. Congratulations and thank you for choosing Marshall. #marshallmoments  https://t.co/lV6npKPmSr,en,"['bmw', 'salisbury', 'marshallmoments']",[],https://twitter.com/Marshall_BMW/status/1512807367288709131,[],['https://pbs.twimg.com/media/FP6SSC_XoAQqjLU.jpg'],1,https://pbs.twimg.com/media/FP6SSC_XoAQqjLU.jpg,2,0,0
14,1.51e+18,NewsleadIndia,India,1650000000000.0,2022-09-04T22:55:00Z,"Speeding BMW car trampled a woman riding a scooty, this terrible accident was captured in CCTV, watch video  https://t.co/X6V2Kq1AkJ",en,[],[],https://twitter.com/NewsleadIndia/status/1512806371221196808,['https://newsleadindia.com/speeding-bmw-car-trampled-a-woman-riding-a-scooty-this-terrible-accident-was-captured-in-cctv-watch-video/'],[],0, ,0,0,0
15,1.51e+18,babybluebarry,USA,1650000000000.0,2022-09-04T22:39:00Z,"11am, just starting the day off, walking into Tims for a coffee and some plug in a bmw calls me stupid. Carpe Diem let’s go eh",en,[],[],https://twitter.com/babybluebarry/status/1512802334463639559,[],[],0, ,0,0,0
16,1.51e+18,Zaack23,France,1650000000000.0,2022-09-04T22:37:00Z,"Nope, no change at 7000rpm. (Yeah only 7000, because BMW.)",en,[],[],https://twitter.com/Zaack23/status/1512801761156902914,[],[],0, ,0,0,0
17,1.51e+18,thegoogle93,India,1650000000000.0,2022-09-04T22:36:00Z,"High-speed BMW car crushes woman riding Scooty, captures horrific accident on CCTV, watch video BMW car hits Scooty woman, watch viral video  https://t.co/rsb12ktoP7",en,[],[],https://twitter.com/thegoogle93/status/1512801623831158784,['https://thegooglenews.in/2022/04/09/high-speed-bmw-car-crushes-woman-riding-scooty-captures-horrific-accident-on-cctv-watch-video-bmw-car-hits-scooty-woman-watch-viral-video/'],[],0, ,0,0,0
18,1.51e+18,tombrossman,France,1650000000000.0,2022-09-04T22:23:00Z,"I have no clue what this confused BMW driver is doing and neither do they. Poor @LibertyBusje driver stuck waiting. I manage to make my way past. Drivers, keep left for faster traffic such as cyclists please!  https://t.co/3N4HTD82fd",en,[],[],https://twitter.com/tombrossman/status/1512798348348203013,[],[],1,https://pbs.twimg.com/ext_tw_video_thumb/1512795639788322821/pu/img/odQX4uf_8mfrWWpi.jpg,0,2,0
19,1.51e+18,HindustanTimes,India,1650000000000.0,2022-09-04T22:19:00Z,"Caught on CCTV camera: BMW car in Mangaluru jumps divider, rams into scooty  https://t.co/fZ6c3CcLJk",en,[],[],https://twitter.com/HindustanTimes/status/1512797423701311492,['https://www.hindustantimes.com/cities/bengaluru-news/caught-on-cctv-camera-bmw-car-in-mangaluru-jumps-divider-rams-into-scooty-101649513492990.html'],[],0, ,2,0,0
20,1.51e+18,AlexWitzleben,France,1650000000000.0,2022-09-04T22:13:00Z,"Demand for electric vehicles rising but battery costs, policy inertia keep prices high as #lithium prices had risen in line with EV demand  https://t.co/Tlh7eSLSOL via @ABCaustralia #EUGreenDeal #ClimateActionNow #ElectricVehicles #ElectricCars #Evs #cars #VW #BMW #Volvo #Renault",en,"['lithium', 'eugreendeal', 'climateactionnow', 'electricvehicles', 'electriccars', 'evs', 'cars', 'vw', 'bmw', 'volvo', 'renault']",[],https://twitter.com/AlexWitzleben/status/1512795947981590529,['https://www.abc.net.au/news/2022-04-08/evs-in-demand-lithium-expensive-government-policy/100969628?utm_campaign=abc_news_web&utm_content=twitter&utm_medium=content_shared&utm_source=abc_news_web'],[],0, ,2,0,1
21,1.51e+18,RetroAdvertsUK,France,1650000000000.0,2022-09-04T22:09:00Z,"The latest addition to my #etsy shop: BMW Car Print 1988, Original Advertising Wall Art  https://t.co/tuGIR79cVA #men #gift #present #bmw #dad #print #father #eighties #m3  https://t.co/oSHEcGLovC",en,"['etsy', 'men', 'gift', 'present', 'bmw', 'dad', 'print', 'father', 'eighties', 'm3']",[],https://twitter.com/RetroAdvertsUK/status/1512794726138843149,['https://etsy.me/3v5UaBJ'],['https://pbs.twimg.com/media/FP6GyWoX0AElpBh.jpg'],1,https://pbs.twimg.com/media/FP6GyWoX0AElpBh.jpg,0,0,0
22,1.51e+18,swapalease,USA,1650000000000.0,2022-09-04T22:00:00Z,"2021 BMW X5 M50i | 23-month lease transfer in East Northport, NY. Details Here:  https://t.co/OLC7umX32S Contact the private seller today.  https://t.co/TnUl8QbYgE",en,[],[],https://twitter.com/swapalease/status/1512792552260390914,['https://bit.ly/3rP088z'],"['https://pbs.twimg.com/media/FP6EzwwXoAYS5vU.jpg', 'https://pbs.twimg.com/media/FP6EzwNX0AsEKCZ.jpg', 'https://pbs.twimg.com/media/FP6EzyFXIAQVSq8.jpg', 'https://pbs.twimg.com/media/FP6EzyKWYAAoKAn.jpg']",1,https://pbs.twimg.com/media/FP6EzwwXoAYS5vU.jpg,0,0,0
23,1.51e+18,Marshall_BMW,France,1650000000000.0,2022-09-04T21:48:00Z,"Marshall #BMW #Grimsby has some fantastic Approved Used models waiting to be snapped up!   Why not speak to one of our BMW experts on 01472 276666, visit us on Grimsby Road, Laceby or view our stock here &gt;  https://t.co/bjGA7vd8Gj  https://t.co/5POSebTQ3q",en,"['bmw', 'grimsby']",[],https://twitter.com/Marshall_BMW/status/1512789529459105792,['https://www.marshall.co.uk/bmw/used-cars/marshall-bmw-of-grimsby/'],"['https://pbs.twimg.com/media/FP6CDe9XwAI2K3k.jpg', 'https://pbs.twimg.com/media/FP6CDe-X0AIhlxI.jpg']",1,https://pbs.twimg.com/media/FP6CDe9XwAI2K3k.jpg,1,0,0
24,1.51e+18,emergingnobody,USA,1650000000000.0,2022-09-04T21:45:00Z,GM  Still available✨ The Ultimate Driving Nobody🚗🚗 @objktcom  2 #tezos    https://t.co/7w0INKA1nL  #tezos #CleanNFT #BMW #M3 #emergingnobody #tezosnft  https://t.co/hx3Rgzjd4G,en,"['tezos', 'tezos', 'cleannft', 'bmw', 'm3', 'emergingnobody', 'tezosnft']",[],https://twitter.com/emergingnobody/status/1512788671648382981,['https://objkt.com/asset/KT1SDnA9KDeoCgsLDyUYCWDJrp6cHQJXLSa1/14'],['https://pbs.twimg.com/media/FP5-MKTakAIiUal.jpg'],1,https://pbs.twimg.com/media/FP5-MKTakAIiUal.jpg,3,0,1
25,1.51e+18,Oneworldnews_,India,1650000000000.0,2022-09-04T21:40:00Z,"On Camera, Speeding BMW Jumps Divider, Rams Woman On Scooty In Mangaluru  #accident #RoadAccident #bmw  https://t.co/5nxj0eP2Fx",en,"['accident', 'roadaccident', 'bmw']",[],https://twitter.com/Oneworldnews_/status/1512787427236016128,[],[],1,https://pbs.twimg.com/ext_tw_video_thumb/1512787335867695107/pu/img/860u5Gl88oLBbral.jpg,11,8,4
26,1.51e+18,Avenger1100,UK,1650000000000.0,2022-09-04T21:37:00Z,New EU directive will allow BMW drivers to use their indicators.,en,[],[],https://twitter.com/Avenger1100/status/1512786681853792257,[],[],0, ,2,0,0
27,1.51e+18,BMW_ParkLane,UK,1650000000000.0,2022-09-04T21:33:00Z,"All-new, all-electric and all-commanding. The BMW iX is designed to make an impression. And it’s now available with a compelling 5.9% APR Representative.    See full offer details:  https://t.co/hLPGAMhV3t  Park Lane Ltd is a credit broker not a lender. Ts&amp;Cs apply.  https://t.co/PQ0byPcUxL",en,[],[],https://twitter.com/BMW_ParkLane/status/1512785659135770627,['https://bit.ly/36UaaPg'],['https://pbs.twimg.com/media/FP5-idqWUAI2NNP.jpg'],1,https://pbs.twimg.com/media/FP5-idqWUAI2NNP.jpg,0,0,0
28,1.51e+18,maximzhestkov,France,1650000000000.0,2022-09-04T21:30:00Z,@grigorev_studio @BMW Thank you! 🖤,en,[],[],https://twitter.com/maximzhestkov/status/1512785124731068421,[],[],0, ,0,0,0
29,1.51e+18,MyIndiafirst,India,1650000000000.0,2022-09-04T21:25:00Z,"On Camera, Speeding BMW Jumps Divider, Smashes Into Woman On Scooty  https://t.co/ciB5AT9VF4",en,[],[],https://twitter.com/MyIndiafirst/status/1512783680057614336,['https://myindiafirst.com/on-camera-speeding-bmw-jumps-divider-smashes-into-woman-on-scooty/'],[],0, ,0,0,0
30,1.51e+18,BMW_ParkLane,UK,1650000000000.0,2022-09-04T21:22:00Z,Amplify your BMW with our BMW M Performance Parts🔥 Take a look on our website today:   https://t.co/xPRCSBnke9  https://t.co/vOKB7neFKe,en,[],[],https://twitter.com/BMW_ParkLane/status/1512782890622406656,['https://bit.ly/3GOcfZF'],"['https://pbs.twimg.com/media/FP58BMTX0AIbT_8.jpg', 'https://pbs.twimg.com/media/FP58BMRXMAcUMiU.jpg', 'https://pbs.twimg.com/media/FP58BMTX0AAA8lQ.jpg', 'https://pbs.twimg.com/media/FP58BMTWQAQkLF3.jpg']",1,https://pbs.twimg.com/media/FP58BMTX0AIbT_8.jpg,0,0,0
31,1.51e+18,GreatBendPost,USA,1650000000000.0,2022-09-04T21:19:00Z,"Kansas man dead, another injured after pickup, BMW crash  https://t.co/bpBiYyqDOv",en,[],[],https://twitter.com/GreatBendPost/status/1512782137103056899,['http://dlvr.it/SNGfSZ'],[],0, ,0,0,0
32,1.51e+18,KnowledgeStall,India,1650000000000.0,2022-09-04T21:18:00Z,"On Camera, Speeding BMW Jumps Divider, Smashes Into Woman On Scooty - NDTV  https://t.co/4idGXKFksi",en,[],[],https://twitter.com/KnowledgeStall/status/1512782013526249474,['http://dlvr.it/SNGfNr'],[],0, ,0,0,0
33,1.51e+18,thealso,UK,1650000000000.0,2022-09-04T21:11:00Z,@RedBSierra No worse than the average BMW,en,[],[],https://twitter.com/thealso/status/1512780349658615811,[],[],0, ,1,0,0
34,1.51e+18,OnlineTheWiki,India,1650000000000.0,2022-09-04T21:11:00Z,"On Camera, Speeding BMW Jumps Divider, Smashes Into Woman On Scooty  https://t.co/EBzIgVGaao",en,[],[],https://twitter.com/OnlineTheWiki/status/1512780327307120643,['https://www.onlinewiki.in/wiki/news/on-camera-speeding-bmw-jumps-divider-smashes-into-woman-on-scooty/'],[],0, ,0,0,0
35,1.51e+18,OzzaT_,France,1650000000000.0,2022-09-04T21:02:00Z,She just wanted u to know she has a BMW 😂😂😂😂,en,[],[],https://twitter.com/OzzaT_/status/1512777923266236418,[],[],0, ,0,0,0
36,1.51e+18,blacklabeluk_,UK,1650000000000.0,2022-09-04T21:00:00Z,"As well as being an urban automotive approved dealer and a driven land jet approved dealer, we source new cars from most manufacturers at very competitive rates including:  Audi Bentley BMW Lamborghini Mercedes Benz  Range Rover Rolls Royce   💻  https://t.co/DOyP5hVnwA  https://t.co/ypbxjg5nLB",en,[],[],https://twitter.com/blacklabeluk_/status/1512777506704834563,['https://bit.ly/BlackLabelLifestyle'],['https://pbs.twimg.com/media/FP53IAjXIAIqw2k.jpg'],1,https://pbs.twimg.com/media/FP53IAjXIAIqw2k.jpg,0,0,0
37,1.51e+18,indiaExam12,India,1650000000000.0,2022-09-04T20:54:00Z,"On Camera, Speeding BMW Jumps Divider, Smashes Into Woman On Scooty  https://t.co/hTCsqGvRlJ",en,[],[],https://twitter.com/indiaExam12/status/1512775873564454918,['https://govtexam.net/on-camera-speeding-bmw-jumps-divider-smashes-into-woman-on-scooty/'],[],0, ,0,0,0
38,1.51e+18,ThriftWallet,USA,1650000000000.0,2022-09-04T20:49:00Z,"On Camera, Speeding BMW Jumps Divider, Rams Woman On Scooty In Mangaluru  https://t.co/dC1WsN2uQZ",en,[],[],https://twitter.com/ThriftWallet/status/1512774670453547011,['https://thriftyourwallet.com/on-camera-speeding-bmw-jumps-divider-rams-woman-on-scooty-in-mangaluru/'],[],0, ,0,0,0
39,1.51e+18,ThriftWallet,USA,1650000000000.0,2022-09-04T20:48:00Z,"On Camera, Speeding BMW Jumps Divider, Rams Woman On Scooty In Mangaluru  https://t.co/62hN3nNi5e",en,[],[],https://twitter.com/ThriftWallet/status/1512774452932657155,['https://tamilnaatunadapu.in/2022/04/09/on-camera-speeding-bmw-jumps-divider-rams-woman-on-scooty-in-mangaluru/'],[],0, ,0,0,0
40,1.51e+18,queen23_selfie,India,1650000000000.0,2022-09-04T20:48:00Z,"On Camera, Speeding BMW Jumps Divider, Rams Woman On Scooty In Mangaluru  https://t.co/zmSI1lkzs7",en,[],[],https://twitter.com/queen23_selfie/status/1512774438189776900,['https://www.currentnewstv.com/on-camera-speeding-bmw-jumps-divider-rams-woman-on-scooty-in-mangaluru/'],[],0, ,0,0,0
41,1.51e+18,moonlhse,UK,1650000000000.0,2022-09-04T20:43:00Z,Someone buy me a BMW Z4 and I’ll pay you back in instalments,en,[],[],https://twitter.com/moonlhse/status/1512773228489547778,[],[],0, ,0,0,0
42,1.51e+18,dzyrl,France,1650000000000.0,2022-09-04T20:42:00Z,"Has Euro English finally won? A “Beamer” is not an actual thing in English, unless you are using a faintly ghastly abbreviation to boast about your BMW.  https://t.co/8yCbtRKz4H",en,[],[],https://twitter.com/dzyrl/status/1512772938226933764,[],['https://pbs.twimg.com/media/FP5y96hWUAUvvy6.jpg'],1,https://pbs.twimg.com/media/FP5y96hWUAUvvy6.jpg,1,0,0
43,1.51e+18,Niikkaa90,Germany,1650000000000.0,2022-09-04T20:39:00Z,Good result from Ilia Mykhalchyk! I know he is very familiar with the BMW bike but still 👍 #WorldSBK #AragonWorldSBK,en,"['worldsbk', 'aragonworldsbk']",[],https://twitter.com/Niikkaa90/status/1512772264789434370,[],[],0, ,0,0,0
44,1.51e+18,PornTweets18,USA,1650000000000.0,2022-09-04T20:31:00Z,@DojaCat @BMW With whom you ride that bmw?,en,[],[],https://twitter.com/PornTweets18/status/1512770187321577476,[],[],0, ,0,0,0
45,1.51e+18,Vl0uKsixYDbn1ot,Singapore,1650000000000.0,2022-09-04T20:30:00Z,"@attemptingbutch @DojaCat @BMW Hi, can we get to know each other?",en,[],[],https://twitter.com/Vl0uKsixYDbn1ot/status/1512769951999795205,[],[],0, ,0,0,0
46,1.51e+18,LuxuryCars365,USA,1650000000000.0,2022-09-04T20:26:00Z,BMW M2 F87 ♠️  https://t.co/N8B8ZzimNm,en,[],[],https://twitter.com/LuxuryCars365/status/1512769035141795840,[],['https://pbs.twimg.com/media/FP5va2EXoAYNXgf.jpg'],1,https://pbs.twimg.com/media/FP5va2EXoAYNXgf.jpg,664,0,70
47,1.51e+18,alexthepage,UK,1650000000000.0,2022-09-04T20:20:00Z,Scott Redding said this week that the BMW is much more exciting to ride than the Ducati. He’s currently running outside of the points in 16th. #AragonWorldSBK,en,['aragonworldsbk'],[],https://twitter.com/alexthepage/status/1512767332036321282,[],[],0, ,2,0,0
48,1.51e+18,Joshcommentator,France,1650000000000.0,2022-09-04T20:15:00Z,"Live @750MotorClub racing from Croft Circuit can be found here:  https://t.co/E3cqBBZggR  Racing today are BMW Car Club, Type-R Trophy, Sports 1000, Clio Sport, 5Club MX5, Ma7da and Hot Hatch.",en,[],[],https://twitter.com/Joshcommentator/status/1512766022394208266,['https://www.youtube.com/watch?v=_hq30TLmKb0'],[],0, ,1,0,1
49,1.51e+18,inventivaindia,India,1650000000000.0,2022-09-04T20:10:00Z,IT firm CEO rewards colleagues’ loyalty with BMW cars  https://t.co/FjB2Vvg51m,en,[],[],https://twitter.com/inventivaindia/status/1512764823116779526,['https://www.inventiva.co.in/trends/it-firm-ceo-rewards/'],[],0, ,0,0,0
50,1.51e+18,CarbonFactory3,France,1650000000000.0,2022-09-04T20:03:00Z,🔥🔥🔥This is selling fast! 🔥🔥🔥  💥💥BMW F10 5 Series 3D Style Carbon Fibre Front Splitter 10-17 💥💥  Speak to us for your CF dose😍😍  🚗Like ● Follow ● Share 🚕  https://t.co/MYvzlAONxE,en,[],[],https://twitter.com/CarbonFactory3/status/1512763094119952385,[],['https://pbs.twimg.com/media/FP5qBKGWUAMbwSK.jpg'],1,https://pbs.twimg.com/media/FP5qBKGWUAMbwSK.jpg,0,0,0
51,1.51e+18,SansaniPatrakar,India,1650000000000.0,2022-09-04T19:59:00Z,"Warning: Graphic content  Crazy accident in Mangalore - BMW jumps divider, crashes into another car  https://t.co/MH6nTNtX2Q",en,[],[],https://twitter.com/SansaniPatrakar/status/1512762126821371904,[],[],1,https://pbs.twimg.com/ext_tw_video_thumb/1512762041781878790/pu/img/dms3k41EPyebvJjB.jpg,0,0,0
52,1.51e+18,OTReSport,France,1650000000000.0,2022-09-04T19:57:00Z,"🟡 #iRacing #24h_of_Nurburgring 🟡  New colours, new design, new partners, new website and.. NEW RACEDAY 🏁   ⏰ At 14:00pm (BST), the 24h of Nurburgring on @iRacing begins!  OTR John02 🇫🇷/ OTR Angy02 🇫🇷 and OTR Amnezouz 🇫🇷 compose #Team_OTR_BarjoZoku on BMW M4 GT3  Good Luck 💪🏻  https://t.co/zZPROklrkV",en,"['iracing', '24h_of_nurburgring', 'team_otr_barjozoku']",[],https://twitter.com/OTReSport/status/1512761565149372416,[],['https://pbs.twimg.com/media/FP5on9kWYAM7xKB.jpg'],1,https://pbs.twimg.com/media/FP5on9kWYAM7xKB.jpg,6,0,1
53,1.51e+18,HutchPost,USA,1650000000000.0,2022-09-04T19:53:00Z,"Kansas man dead, another injured after pickup, BMW crash  https://t.co/aRex18oryU",en,[],[],https://twitter.com/HutchPost/status/1512760493961736195,['http://dlvr.it/SNGTC1'],[],0, ,0,0,0
54,1.51e+18,SalinaPost,USA,1650000000000.0,2022-09-04T19:51:00Z,"Kansas man dead, another injured after pickup, BMW crash  https://t.co/VfPbMbIfq2",en,[],[],https://twitter.com/SalinaPost/status/1512759988371918852,['http://dlvr.it/SNGSvg'],[],0, ,0,0,0
55,1.51e+18,hayspost,USA,1650000000000.0,2022-09-04T19:48:00Z,"Kansas man dead, another injured after pickup, BMW crash  https://t.co/8uh3M0IGGY",en,[],[],https://twitter.com/hayspost/status/1512759362300747778,['http://dlvr.it/SNGSkk'],[],0, ,0,0,0
56,1.51e+18,Gerryinger1,Germany,1650000000000.0,2022-09-04T19:47:00Z,@jmvasquez1974 Looks like the original. Authentic with some spare part areas to restore functionality... Is this a replica or an original sidecar BMW R 12??? 🤔,en,[],[],https://twitter.com/Gerryinger1/status/1512759165881569281,[],[],0, ,0,0,0
57,1.51e+18,crypto_merlion,Singapore,1650000000000.0,2022-09-04T19:29:00Z,"@satsdart I think that's a 488 - list price is about £170k in the UK (sigh - that's like the price of a basic BMW in Singapore) - and they drove about 3,200m. So it just them just over £50 per metre.",en,[],[],https://twitter.com/crypto_merlion/status/1512754646036537350,[],[],0, ,2,3,0
58,1.51e+18,XrpLauren,UK,1650000000000.0,2022-09-04T19:23:00Z,@K1TSUNE20 @AlexCobb_ Not as much as BMW though,en,[],[],https://twitter.com/XrpLauren/status/1512753047914565635,[],[],0, ,0,1,0
59,1.51e+18,manatrue,UK,1650000000000.0,2022-09-04T19:22:00Z,@perfumeithaki @redflag3rd @cool_grandad USA greedy for BMW ?   Biden made wheels lol,en,[],[],https://twitter.com/manatrue/status/1512752845497552897,[],[],0, ,2,1,1
60,1.51e+18,97_affan,France,1650000000000.0,2022-09-04T19:21:00Z,"When Brentford were in the Championship I used to watch their games a lot. Their trio 'BMW' (Benrahma, Mbuemo and Watkins) used to tear the league apart. They probably deserved to be promoted in the 19/20 season but lost to Fulham who got relegated again.",en,[],[],https://twitter.com/97_affan/status/1512752665003966464,[],[],0, ,0,0,0
61,1.51e+18,rvp,India,1650000000000.0,2022-09-04T19:20:00Z,#RaviVisvesvarayaSharadaPrasad   https://t.co/DWWfus8eO1 IT firm Kissflow Inc rewards senior executives&amp;#039; loyalty with BMW cars,en,['ravivisvesvarayasharadaprasad'],[],https://twitter.com/rvp/status/1512752297624981504,['https://www.businesstoday.in/latest/corporate/story/it-firm-kissflow-inc-rewards-senior-executives-loyalty-with-bmw-cars-329272-2022-04-09?utm_source=rssfeed'],[],0, ,0,0,0
62,1.51e+18,IkeHorsman,UK,1650000000000.0,2022-09-04T19:15:00Z,"@motomatters Jeez how bad is Scott Redding doing on the BMW, he’s getting out qualified by all other BMW riders, even the stand in temp rider, not looking good for him at all.",en,[],[],https://twitter.com/IkeHorsman/status/1512751112247558151,[],[],0, ,1,0,0
63,1.51e+18,cjdracing1969,UK,1650000000000.0,2022-09-04T19:13:00Z,@HerrBonden @BMW_UK what are your thoughts on this chain of tweets? If it is genuine then please comment. If it is bogus then please get it removed. It’s YOUR Brand. @BMWGroup,en,[],[],https://twitter.com/cjdracing1969/status/1512750627604082693,[],[],0, ,3,0,0
64,1.51e+18,carsstoon,USA,1650000000000.0,2022-09-04T19:05:00Z,3 alpina bmw b7 xdrive drawing carstoon concept Canvas Print #cars #ArtistOnTwitter #drawings -  https://t.co/uWulU3Z1e0  https://t.co/qp8iOejwZ3,en,"['cars', 'artistontwitter', 'drawings']",[],https://twitter.com/carsstoon/status/1512748590921306113,['https://ift.tt/EreKvoH'],['https://pbs.twimg.com/media/FP5c079XEAYVOke.jpg'],1,https://pbs.twimg.com/media/FP5c079XEAYVOke.jpg,2,0,0
65,1.51e+18,HSouthwellFE,UK,1650000000000.0,2022-09-04T19:04:00Z,"@theniki94 nah BMW wouldn't re-enter, it's just kind of funny that there's this strange web of Audi/Merc/BMW - Nissan would be the most likely, they want a customer team (as do Porsche)",en,[],[],https://twitter.com/HSouthwellFE/status/1512748290097491970,[],[],0, ,7,2,0
66,1.51e+18,KieranR71745774,UK,1650000000000.0,2022-09-04T19:03:00Z,@OddBawZ Loving that two-tone BMW. Love the old style,en,[],[],https://twitter.com/KieranR71745774/status/1512748123419906052,[],[],0, ,0,0,0
67,1.51e+18,theniki94,France,1650000000000.0,2022-09-04T19:00:00Z,@HSouthwellFE BMW again? We've already been through this. Also i read here for Nissan but I'm not sure  https://t.co/LLZeY59oVa,en,[],[],https://twitter.com/theniki94/status/1512747391719518209,['https://the-race.com/formula-e/nissan-deal-for-mclaren-linked-mercedes-formula-e-team-takeover/'],[],0, ,2,1,0
68,1.51e+18,HSouthwellFE,France,1650000000000.0,2022-09-04T18:51:00Z,"(because McL are developing an EV platform with BMW, if rumours are to be believed. anyway, all of this is ✨speculation✨ of course)  (McL signed an agreement to explore an FE entry in January 2021, that bit's for sure &amp; it's all been quite quiet since but Gen3 comes soon...)",en,[],[],https://twitter.com/HSouthwellFE/status/1512745036382937095,[],[],0, ,61,2,2
69,1.51e+18,HSouthwellFE,France,1650000000000.0,2022-09-04T18:51:00Z,"the baffling web of German OEMs and McLaren rumours continue: looks likely McL will rebadge the current Merc FE team - they'd need a powertrain supplier for next year, though, since Merc are out. BMW would be the obvious except they are too...",en,[],[],https://twitter.com/HSouthwellFE/status/1512745035040804869,[],[],0, ,160,6,7
