,id,username,created_at,date,tweet,language,hashtags,cashtags,link,urls,photos,video,thumbnail,nlikes,nreplies,nretweets
374,1508587237214236680,ZeeNewsEnglish,1648510200000.0,2022-03-29 07:30:00,#RohitSharma buys a #Lamborghini Urus SUV worth a whopping Rs 3.15 crore   https://t.co/TUUurw4T0u,en,"['rohitsharma', 'lamborghini']",[],https://twitter.com/ZeeNewsEnglish/status/1508587237214236680,['https://zeenews.india.com/auto/cricketer-rohit-sharma-buys-lamborghini-urus-suv-for-rs-3-15-crore-painted-in-team-india-colour-2441226.html?fbclid=IwAR2AZ5m2897-M8-xdCTYjzERGmjU23h1kfYOrf4T1dxQwVfAvOPBCbG3Ypw'],[],0,,18,1,1
375,1508579717951205384,PUBGMOBILE,1648508407000.0,2022-03-29 07:00:07,"Speed through the battlefield 💥 with the Lamborghini vehicles! 🚗 💨   New luxury ✨ UAZ, Dacia, and Coupe RB are available in the game now! 🤩   🔗  https://t.co/7yVBd2u0x9  #PUBGMOBILE #Lamborghini #URUS #Estoque #AventadorSVJ  https://t.co/unLxbTE6iG",en,"['pubgmobile', 'lamborghini', 'urus', 'estoque', 'aventadorsvj']",[],https://twitter.com/PUBGMOBILE/status/1508579717951205384,['https://pubgmobile.live/Lamborghini'],['https://pbs.twimg.com/media/FO-NQhGWYAAPQcr.jpg'],1,https://pbs.twimg.com/media/FO-NQhGWYAAPQcr.jpg,191,18,8
376,1508575390863929348,AdamEShelton,1648507375000.0,2022-03-29 06:42:55,Dannnnng! I want a lambo!  @lamborghinu_io  https://t.co/AVbYFCq5LY,en,[],[],https://twitter.com/AdamEShelton/status/1508575390863929348,[],['https://pbs.twimg.com/tweet_video_thumb/FO-JPZ2X0AMd_j3.jpg'],1,https://pbs.twimg.com/tweet_video_thumb/FO-JPZ2X0AMd_j3.jpg,72,78,30
378,1508564228587888647,gabbariele,1648504714000.0,2022-03-29 05:58:34,"Read the #casestudy of #Danone in my new #book with #PhilipKotler, Denis Rothman and other gurus. We have defined the Essentials of Modern #Marketing with cases of #Lamborghini #Knauf #iliad #Bauli and many others.  https://t.co/UjfEezjpAt #bebrilliant #EOMM #purpose #books  https://t.co/ed9nTBc2hp",en,"['casestudy', 'danone', 'book', 'philipkotler', 'marketing', 'lamborghini', 'knauf', 'iliad', 'bauli', 'bebrilliant', 'eomm', 'purpose', 'books']",[],https://twitter.com/gabbariele/status/1508564228587888647,['https://eomm.bebrilliant.it/'],['https://pbs.twimg.com/media/FO9_K51XsAUcbCS.jpg'],1,https://pbs.twimg.com/media/FO9_K51XsAUcbCS.jpg,3,0,0
379,1508550646995247124,gabbariele,1648501476000.0,2022-03-29 05:04:36,"Read the #casestudy of #Lamborghini in my new #book with #PhilipKotler, Denis Rothman and other gurus. We have defined the Essentials of Modern #Marketing with cases of #Danone #Knauf #iliad #Bauli and many others.  https://t.co/UjfEezjpAt #bebrilliant #EOMM #purpose #books  https://t.co/7NGARSrglE",en,"['casestudy', 'lamborghini', 'book', 'philipkotler', 'marketing', 'danone', 'knauf', 'iliad', 'bauli', 'bebrilliant', 'eomm', 'purpose', 'books']",[],https://twitter.com/gabbariele/status/1508550646995247124,['https://eomm.bebrilliant.it/'],['https://pbs.twimg.com/media/FO9y0ZHXIA8Yb0L.jpg'],1,https://pbs.twimg.com/media/FO9y0ZHXIA8Yb0L.jpg,0,0,0
380,1508550617756745735,gabbariele,1648501469000.0,2022-03-29 05:04:29,"Read the #casestudy of #Lamborghini in my new #book with #PhilipKotler, Denis Rothman and other gurus. We have defined the Essentials of Modern #Marketing with cases of #Danone #Knauf #iliad #Bauli and many others.  https://t.co/UjfEezjpAt #bebrilliant #EOMM #purpose #books  https://t.co/7i9biBsz57",en,"['casestudy', 'lamborghini', 'book', 'philipkotler', 'marketing', 'danone', 'knauf', 'iliad', 'bauli', 'bebrilliant', 'eomm', 'purpose', 'books']",[],https://twitter.com/gabbariele/status/1508550617756745735,['https://eomm.bebrilliant.it/'],['https://pbs.twimg.com/media/FO9yysmXEAgpj0M.jpg'],1,https://pbs.twimg.com/media/FO9yysmXEAgpj0M.jpg,0,0,0
381,1508547904000061443,ArsenalRL,1648500822000.0,2022-03-29 04:53:42,Is the lambo the new prime car @Joyokamii,en,[],[],https://twitter.com/ArsenalRL/status/1508547904000061443,[],[],0,,637,4,1
382,1508540553213923337,Tom_Winter,1648499069000.0,2022-03-29 04:24:29,"NBC News: 'Biggest fraud in a generation': The looting of the Covid relief plan known as PPP.   Lambo'ss, Ferrari's, Bentley's, and a lot of Tesla's bought by fraudsters with your money.   The first in a series of reports:  https://t.co/rzALblCZvh  https://t.co/FC7sI4wnEp",en,[],[],https://twitter.com/Tom_Winter/status/1508540553213923337,['https://www.nbcnews.com/politics/justice-department/biggest-fraud-generation-looting-covid-relief-program-known-ppp-n1279664'],['https://pbs.twimg.com/media/FO9pjD0WUAIFJg4.jpg'],1,https://pbs.twimg.com/media/FO9pjD0WUAIFJg4.jpg,4157,341,2078
383,1508535036148166662,gabbariele,1648497754000.0,2022-03-29 04:02:34,"""Essentials of Modern Marketing is a unique book with local case studies of brilliant companies building a better world through marketing"" Gabriele Carboni. Discover the book:  https://t.co/UjfEezjpAt with cases of #Danone #Lamborghini #marketing #iliad #Knauf #PhilipKotler #EOMM  https://t.co/3DzxjfQiKA",en,"['danone', 'lamborghini', 'marketing', 'iliad', 'knauf', 'philipkotler', 'eomm']",[],https://twitter.com/gabbariele/status/1508535036148166662,['https://eomm.bebrilliant.it/'],['https://pbs.twimg.com/media/FO9kntwWUAko__E.jpg'],1,https://pbs.twimg.com/media/FO9kntwWUAko__E.jpg,0,0,0
385,1508519357890154508,LevelInfinite,1648494016000.0,2022-03-29 03:00:16,vroom vrooom 💨 have you unlocked your Lamborghini on @PUBGMOBILE yet??😎  https://t.co/Mn8jFWNlpj,en,[],[],https://twitter.com/LevelInfinite/status/1508519357890154508,['https://lvli.li/3LmbFUQ'],[],0,,5,0,0
386,1508514273315672075,LilyMercer,1648492804000.0,2022-03-29 02:40:04,Excited to talk music with these incredibly talented women tonight via @hypebeast 💖 Tune in at 8pm EST [1am BST]  https://t.co/jLAPmeZVtI,en,[],[],https://twitter.com/LilyMercer/status/1508514273315672075,[],['https://pbs.twimg.com/media/FO9RvDAWUBMAEzl.jpg'],1,https://pbs.twimg.com/media/FO9RvDAWUBMAEzl.jpg,1,0,0
387,1508510349041020933,gabbariele,1648491868000.0,2022-03-29 02:24:28,#PhilipKotler on Essentials of Modern #Marketing:   https://t.co/46mGzzTBWz #visualcommunicationplanner #marketingcanvas #VCP #digitalstrategy #bebrilliant #anewpathtodigital #EOMM #caterpillarbrands #books #tiktok #Danone #Lamborghini #Knauf #Clementoni #Safilo #Bauli,en,"['philipkotler', 'marketing', 'visualcommunicationplanner', 'marketingcanvas', 'vcp', 'digitalstrategy', 'bebrilliant', 'anewpathtodigital', 'eomm', 'caterpillarbrands', 'books', 'tiktok', 'danone', 'lamborghini', 'knauf', 'clementoni', 'safilo', 'bauli']",[],https://twitter.com/gabbariele/status/1508510349041020933,['https://www.tiktok.com/@gabbariele_official/video/7061577986172144902?is_copy_url=1&is_from_webapp=v1'],[],0,,1,0,0
389,1508499687959056386,LeahGraceD,1648489326000.0,2022-03-29 01:42:06,"Best soundbite had to be when Johnson was asked about working with #Badgers Braelon Allen  ""There's moments where it feels like Dad let you take the Lamborghini out and you don't want to crash that baby.""  https://t.co/9D29t5gH6T",en,['badgers'],[],https://twitter.com/LeahGraceD/status/1508499687959056386,[],[],1,https://pbs.twimg.com/ext_tw_video_thumb/1508499568765411337/pu/img/ENwcjE331y33PfZH.jpg,2,0,1
390,1508497498163212288,_groww,1648488804000.0,2022-03-29 01:33:24,Lamborghini announced that it has crossed the 400 cumulative sales mark in India since initiating full-scale operations in 2007.,en,[],[],https://twitter.com/_groww/status/1508497498163212288,[],[],0,,13,2,1
391,1508496498169892880,Krista_Kim,1648488566000.0,2022-03-29 01:29:26,"We are ready to open a new road, with @Lamborghini @Krista_Kim @steveaoki @INVNTGROUP  Stay tuned.  #Ultimate #Lamborghini  https://t.co/tPXWEJMTYX",en,"['ultimate', 'lamborghini']",[],https://twitter.com/Krista_Kim/status/1508496498169892880,[],[],1,https://pbs.twimg.com/ext_tw_video_thumb/1508496453173497858/pu/img/nq9auj-n9Fs8EohZ.jpg,56,8,10
392,1508494449206210564,steveaoki,1648488077000.0,2022-03-29 01:21:17,"Opening a new road, with @Lamborghini @Krista_Kim  @INVNTGROUP   More soon.  #Ultimate #Lamborghini  https://t.co/LvbPCQuoeK",en,"['ultimate', 'lamborghini']",[],https://twitter.com/steveaoki/status/1508494449206210564,[],[],1,https://pbs.twimg.com/ext_tw_video_thumb/1508493628070502400/pu/img/IzaPtvcUjVfAS32N.jpg,186,23,41
393,1508491916174045184,ians_india,1648487473000.0,2022-03-29 01:11:13,Super-luxury automaker #Lamborghini India said on Monday that it has achieved the milestone of delivering 400 Lamborghini across the country since its full business operation commenced in 2007.  Photo: @Lamborghini  https://t.co/OB3FBgNoY8,en,['lamborghini'],[],https://twitter.com/ians_india/status/1508491916174045184,[],['https://pbs.twimg.com/media/FO89XeWaMAArRPp.jpg'],1,https://pbs.twimg.com/media/FO89XeWaMAArRPp.jpg,5,0,1
394,1508485736630296583,gabbariele,1648486000000.0,2022-03-29 00:46:40,"Fabrizio Gavelli, General Manager of #Danone in #Italy and #Greece on the #book Essentials of Modern #Marketing:  https://t.co/AtO916mrNH #VCP #bebrilliant #anewpathtodigital #EOMM #caterpillarbrands #books #tiktok #Lamborghini #Knauf #Clementoni #Safilo #Bauli",en,"['danone', 'italy', 'greece', 'book', 'marketing', 'vcp', 'bebrilliant', 'anewpathtodigital', 'eomm', 'caterpillarbrands', 'books', 'tiktok', 'lamborghini', 'knauf', 'clementoni', 'safilo', 'bauli']",[],https://twitter.com/gabbariele/status/1508485736630296583,['https://www.tiktok.com/@gabbariele_official/video/7063189553649306885?is_copy_url=1&is_from_webapp=v1'],[],0,,0,0,0
395,1508478272799133699,TrueAchievement,1648484221000.0,2022-03-29 00:17:01,You'll soon be able to take the Lamborghini Countach LPI 800-4 for a spin in Rocket League. Here's when it's coming...  https://t.co/RA56X6LPu8,en,[],[],https://twitter.com/TrueAchievement/status/1508478272799133699,['https://www.trueachievements.com/n49143/rocket-league-lamborghini-countach'],[],0,,6,1,2
396,1508477101015384064,JeremyCom,1648483941000.0,2022-03-29 00:12:21,@Lamborghini @Krista_Kim @steveaoki @INVNTGROUP Steve Aoki + Lamborghini.  Love this!,en,[],[],https://twitter.com/JeremyCom/status/1508477101015384064,[],[],0,,3,0,0
397,1508476714573352966,Lamborghini,1648483849000.0,2022-03-29 00:10:49,"We are ready to open a new road, with @Krista_Kim, @steveaoki and @INVNTGROUP.​  Stay tuned.​  #Lamborghini #Ultimate  https://t.co/Cdnr39wvMV",en,"['lamborghini', 'ultimate']",[],https://twitter.com/Lamborghini/status/1508476714573352966,[],[],1,https://pbs.twimg.com/media/FO8s31TXsAkWEHg.jpg,473,29,73
404,1508446680898805767,whizkidd,1648476688000.0,2022-03-28 22:11:28,Shyaa! Cancelled my plans to buy a Lambo. Too common these days.,en,[],[],https://twitter.com/whizkidd/status/1508446680898805767,[],[],0,,5,0,1
405,1508446059411886081,hormazdsorabjee,1648476540000.0,2022-03-28 22:09:00,That’s no small number for a market like in India in which @Lamborghini has obliterated @Ferrari thanks largely to the ever popular &amp; practical  #Urus,en,['urus'],[],https://twitter.com/hormazdsorabjee/status/1508446059411886081,[],[],0,,35,3,0
406,1508444525374623759,gabbariele,1648476175000.0,2022-03-28 22:02:55,"""This book presents an up-to-date and insightful account of the working of modern marketing in today's troubled time."" #PhilpKotler. Discover the #book:  https://t.co/UjfEezjpAt with cases of #Danone #Lamborghini #marketing #iliad #Knauf #EOMM #bebrilliant #purpose #sustainability  https://t.co/LIBjVVrD7a",en,"['philpkotler', 'book', 'danone', 'lamborghini', 'marketing', 'iliad', 'knauf', 'eomm', 'bebrilliant', 'purpose', 'sustainability']",[],https://twitter.com/gabbariele/status/1508444525374623759,['https://eomm.bebrilliant.it/'],['https://pbs.twimg.com/media/FO8STUSWUAACIzg.jpg'],1,https://pbs.twimg.com/media/FO8STUSWUAACIzg.jpg,0,0,0
410,1508430612083798025,autocarindiamag,1648472857000.0,2022-03-28 21:07:37,"It took @Lamborghini 15 years to sell 300 cars in India (achieved in Sep 2021). Now just months later, the carmaker has reached the 400-unit sales milestone:  https://t.co/nVFpvjOy4j",en,[],[],https://twitter.com/autocarindiamag/status/1508430612083798025,['https://www.autocarindia.com/car-news/lamborghini-india-crosses-400-unit-sales-milestone-records-86-percent-growth-423979'],[],0,,49,1,3
411,1508420617544028162,garygastelu,1648470474000.0,2022-03-28 20:27:54,"@tonn_chris ""Chris Rock pulled over in Lamborghini by police after declaring bullying is good""... link to Comedians in Cars clip.",en,[],[],https://twitter.com/garygastelu/status/1508420617544028162,[],[],0,,2,0,0
412,1508408474488619011,carandbike,1648467579000.0,2022-03-28 19:39:39,"The third edition of #LamborghiniDay marked @Lamborghini delivering its 400th car in the country, hitting a new milestone! Details:  https://t.co/lRsTMaF1H2  https://t.co/mE6CYL9TWn",en,['lamborghiniday'],[],https://twitter.com/carandbike/status/1508408474488619011,['https://www.carandbike.com/news/lamborghini-india-achieves-a-new-milestone-as-sales-cross-the-400-mark-shares-it-with-3rd-edition-of-lamborghini-day-2846917'],['https://pbs.twimg.com/media/FO7s3xBVgAA70is.jpg'],1,https://pbs.twimg.com/media/FO7s3xBVgAA70is.jpg,29,1,3
413,1508404354906210306,omaakatugba,1648466597000.0,2022-03-28 19:23:17,Daddy and son talking Nig things. My son wants a Lamborghini.  https://t.co/QjoxqkcJ0z,en,[],[],https://twitter.com/omaakatugba/status/1508404354906210306,[],[],1,https://pbs.twimg.com/ext_tw_video_thumb/1508400167594115076/pu/img/S3jCKrivxEsErKza.jpg,78,4,4
415,1508390626215313412,RogerODonnellX,1648463324000.0,2022-03-28 18:28:44,"@HillF1 Stefano is a good guy and has to toe the line I suppose… he could always tell the truth, that we all know and go back to Lamborghini. @HillF1 how did you feel and what did you say about driving a cigarette packet for years and years. Deaths to tobacco 1m x more….",en,[],[],https://twitter.com/RogerODonnellX/status/1508390626215313412,[],[],0,,2,1,0
419,1508374463125065733,gabbariele,1648459470000.0,2022-03-28 17:24:30,Highlights of the launching event of Essentials of Modern #Marketing:  https://t.co/GSSRgXXkkw #visualcommunicationplanner #marketingcanvas #VCP #digitalstrategy #bebrilliant #anewpathtodigital #EOMM #caterpillarbrands #books #tiktok #Danone #Lamborghini #Knauf #Clementoni #hfarm,en,"['marketing', 'visualcommunicationplanner', 'marketingcanvas', 'vcp', 'digitalstrategy', 'bebrilliant', 'anewpathtodigital', 'eomm', 'caterpillarbrands', 'books', 'tiktok', 'danone', 'lamborghini', 'knauf', 'clementoni', 'hfarm']",[],https://twitter.com/gabbariele/status/1508374463125065733,['https://www.tiktok.com/@gabbariele_official/video/7061893180991622406?is_copy_url=1&is_from_webapp=v1'],[],0,,1,0,0
420,1508364041969975302,4eyedmonk,1648456986000.0,2022-03-28 16:43:06,"Chris considered it…for a moment, but then remembered he could get a new Lambo from this debacle…so he pretended to be the bigger black man. 😀  https://t.co/pb3QcghRji",en,[],[],https://twitter.com/4eyedmonk/status/1508364041969975302,[],['https://pbs.twimg.com/media/FO7JGhdXMAQsVc6.jpg'],1,https://pbs.twimg.com/media/FO7JGhdXMAQsVc6.jpg,14,3,4
422,1508360094849077248,business_today,1648456045000.0,2022-03-28 16:27:25,"This record of #Lamborghini’s came on the back of its sales of 69 cars, a growth of 86%, in 2021 due to the popularity of its SUV Urus in India.    https://t.co/6GMqmrLFcv",en,['lamborghini'],[],https://twitter.com/business_today/status/1508360094849077248,['https://www.businesstoday.in/auto/story/lamborghini-sells-400th-car-in-india-plans-new-trims-of-urus-huracan-in-2022-327576-2022-03-28'],[],0,,1,0,1
423,1508356192933928963,Lamborghini,1648455114000.0,2022-03-28 16:11:54,"We love every place where style and sporty attitude can meet, and we found a new one in our latest collaboration with 24Bottles. The result? These two amazing creations, called Clima Bottle and Travel Tumbler.​  #Lamborghini #24Bottles",en,"['lamborghini', '24bottles']",[],https://twitter.com/Lamborghini/status/1508356192933928963,[],[],0,,523,6,41
425,1508353202797744138,NewstalkZB,1648454402000.0,2022-03-28 16:00:02,Ferrari and Lamborghini among $7m of assets seized from alleged importer of NZ's biggest meth bust   https://t.co/RbYUiKXZoA,en,[],[],https://twitter.com/NewstalkZB/status/1508353202797744138,['https://bit.ly/3tFIztD'],[],0,,5,1,1
426,1508332686124982273,gabbariele,1648449510000.0,2022-03-28 14:38:30,Get a free sample of my new #book with #PhilipKotler - Denis Rothman and other gurus. We have defined the Essentials of Modern #Marketing with cases of #Danone #Lamborghini #Knauf #iliad #Bauli and many others.  https://t.co/UjfEezjpAt #bebrilliant #EOMM #purpose  https://t.co/ummpXdmAsr,en,"['book', 'philipkotler', 'marketing', 'danone', 'lamborghini', 'knauf', 'iliad', 'bauli', 'bebrilliant', 'eomm', 'purpose']",[],https://twitter.com/gabbariele/status/1508332686124982273,['https://eomm.bebrilliant.it/'],['https://pbs.twimg.com/media/FO6slclXwAUWZqC.png'],1,https://pbs.twimg.com/media/FO6slclXwAUWZqC.png,0,0,0
429,1508303805049409538,arrosen76,1648442624000.0,2022-03-28 12:43:44,"@paytonisnotroll @liv_cowherd thanks for saving me from those lions and scaring them off, appreciate it man, and when should I return the Lamborghini you gave me?",en,[],[],https://twitter.com/arrosen76/status/1508303805049409538,[],[],0,,3,1,0
430,1508300425216200711,DrDisrespect,1648441818000.0,2022-03-28 12:30:18,@KarlJacobs_ @LudwigAhgren @ConnorEatsPants No…. You’re gonna run Minecraft with me and forget Ludwig.  Lambo is on the line…,en,[],[],https://twitter.com/DrDisrespect/status/1508300425216200711,[],[],0,,873,17,5
431,1508297077431828480,RobMayeda,1648441020000.0,2022-03-28 12:17:00,@Lambo_Gambo @OpinionMerchant @nbcbayarea Indeed they are … prob won’t pick up inland until after midnight. Might need to make up the difference with convective showers tomorrow. Mtns esp S/SW facing slopes are the big winners here,en,[],[],https://twitter.com/RobMayeda/status/1508297077431828480,[],[],0,,1,1,0
432,1508265318443110404,nzherald,1648433448000.0,2022-03-28 10:10:48,NZ's biggest meth bust: Ferrari and Lambo among assets seized from alleged importer   https://t.co/wDS9DWpJ0K  https://t.co/BUMF26VT8c,en,[],[],https://twitter.com/nzherald/status/1508265318443110404,['https://www.nzherald.co.nz/nz/ferrari-and-lamborghini-among-7m-of-assets-seized-from-alleged-importer-of-new-zealands-biggest-meth-bust/ULRHPBAOQUQ5FZEKDUPVG6SFLA/?utm_campaign=nzh_tw&utm_medium=Social&utm_source=Twitter&utm_campaign=nzh_tw#Echobox=1648432969-1'],['https://pbs.twimg.com/media/FO5vUC9X0AUjd6j.jpg'],1,https://pbs.twimg.com/media/FO5vUC9X0AUjd6j.jpg,3,0,0
433,1508262023922012165,jaredsavageNZH,1648432663000.0,2022-03-28 09:57:43,"Ferrari and Lamborghini among $7m of assets seized from alleged importer of New Zealand's biggest meth bust, via @nzherald  https://t.co/zUiNQNGOcb",en,[],[],https://twitter.com/jaredsavageNZH/status/1508262023922012165,['https://www.nzherald.co.nz/nz/ferrari-and-lamborghini-among-7m-of-assets-seized-from-alleged-importer-of-new-zealands-biggest-meth-bust/ULRHPBAOQUQ5FZEKDUPVG6SFLA/'],[],0,,10,1,4
438,1508247319543754754,Tanizhq,1648429157000.0,2022-03-28 08:59:17,@AmourKrim @Jollztv Hey Bea thanks for saving my cat the other day haha and i really appreciate you loaning me $10 000 to help fix my house. i parked the lambo that u leant me back in ur garage while you were out helping kittens find their mothers ty for letting me use it,en,[],[],https://twitter.com/Tanizhq/status/1508247319543754754,[],[],0,,2,1,0
443,1508212630082797574,vfkeng,1648420886000.0,2022-03-28 06:41:26,#NFTs money? 👀  #lambo  https://t.co/aBzrr8smIR,en,"['nfts', 'lambo']",[],https://twitter.com/vfkeng/status/1508212630082797574,[],[],1,https://pbs.twimg.com/ext_tw_video_thumb/1508212535132143620/pu/img/SVnfZZBqqph2v0x9.jpg,16,1,0
444,1508202261381537795,nbcbayarea,1648418414000.0,2022-03-28 06:00:14,"""High-end sports car. Faster than a Ferrari. Faster than a Lamborghini ... It's like being shot out of a slingshot,"" said James Whittaker, an original Roadster owner, recalling his initial ride.  https://t.co/FQJQA683SS",en,[],[],https://twitter.com/nbcbayarea/status/1508202261381537795,['http://nbcbay.com/1YzN5jn'],[],0,,4,1,3
445,1508201765157621763,gabbariele,1648418296000.0,2022-03-28 05:58:16,"Read the #casestudy of #Danone in my new #book with #PhilipKotler, Denis Rothman and other gurus. We have defined the Essentials of Modern #Marketing with cases of #Lamborghini #Knauf #iliad #Bauli and many others.  https://t.co/UjfEezjpAt #bebrilliant #EOMM #purpose #books  https://t.co/01Qlw1fmtG",en,"['casestudy', 'danone', 'book', 'philipkotler', 'marketing', 'lamborghini', 'knauf', 'iliad', 'bauli', 'bebrilliant', 'eomm', 'purpose', 'books']",[],https://twitter.com/gabbariele/status/1508201765157621763,['https://eomm.bebrilliant.it/'],['https://pbs.twimg.com/media/FO41gzXWQAMi7Zb.jpg'],1,https://pbs.twimg.com/media/FO41gzXWQAMi7Zb.jpg,1,0,0
449,1508188179660165125,gabbariele,1648415057000.0,2022-03-28 05:04:17,"Read the #casestudy of #Lamborghini in my new #book with #PhilipKotler, Denis Rothman and other gurus. We have defined the Essentials of Modern #Marketing with cases of #Danone #Knauf #iliad #Bauli and many others.  https://t.co/UjfEezjpAt #bebrilliant #EOMM #purpose #books  https://t.co/rD3MKBpu7r",en,"['casestudy', 'lamborghini', 'book', 'philipkotler', 'marketing', 'danone', 'knauf', 'iliad', 'bauli', 'bebrilliant', 'eomm', 'purpose', 'books']",[],https://twitter.com/gabbariele/status/1508188179660165125,['https://eomm.bebrilliant.it/'],['https://pbs.twimg.com/media/FO4pKCMWUAgINMC.jpg'],1,https://pbs.twimg.com/media/FO4pKCMWUAgINMC.jpg,0,0,0
450,1508187693645283344,gabbariele,1648414941000.0,2022-03-28 05:02:21,"Read the #casestudy of #Lamborghini in my new #book with #PhilipKotler, Denis Rothman and other gurus. We have defined the Essentials of Modern #Marketing with cases of #Danone #Knauf #iliad #Bauli and many others.  https://t.co/UjfEezjpAt #bebrilliant #EOMM #purpose #books  https://t.co/vJOsYnH01K",en,"['casestudy', 'lamborghini', 'book', 'philipkotler', 'marketing', 'danone', 'knauf', 'iliad', 'bauli', 'bebrilliant', 'eomm', 'purpose', 'books']",[],https://twitter.com/gabbariele/status/1508187693645283344,['https://eomm.bebrilliant.it/'],['https://pbs.twimg.com/media/FO4ots7X0AkMx6d.jpg'],1,https://pbs.twimg.com/media/FO4ots7X0AkMx6d.jpg,0,0,0
453,1508180735441584130,ExplosiveGyro,1648413282000.0,2022-03-28 04:34:42,WAIT WHAT IF THEYRE GIVING AWAY A LAMBO TO PPL THAT ATTENDED THE MAJOR,en,[],[],https://twitter.com/ExplosiveGyro/status/1508180735441584130,[],[],0,,566,11,2
454,1508179867866742787,DaveTheCarGuy,1648413075000.0,2022-03-28 04:31:15,@Ant_I_R_Legend @AMG133 @Zero2Turbo @Lamborghini @gmancarreviews I really want to drive that thing.,en,[],[],https://twitter.com/DaveTheCarGuy/status/1508179867866742787,[],[],0,,2,2,0
459,1508172574731218946,gabbariele,1648411336000.0,2022-03-28 04:02:16,"""Essentials of Modern Marketing is a unique book with local case studies of brilliant companies building a better world through marketing"" Gabriele Carboni. Discover the book:  https://t.co/UjfEezjpAt with cases of #Danone #Lamborghini #marketing #iliad #Knauf #PhilipKotler #EOMM  https://t.co/cLUrPhmCaz",en,"['danone', 'lamborghini', 'marketing', 'iliad', 'knauf', 'philipkotler', 'eomm']",[],https://twitter.com/gabbariele/status/1508172574731218946,['https://eomm.bebrilliant.it/'],['https://pbs.twimg.com/media/FO4a9uBXoAUHsdo.jpg'],1,https://pbs.twimg.com/media/FO4a9uBXoAUHsdo.jpg,0,0,0
462,1508150531042295830,USNewsCars,1648406081000.0,2022-03-28 02:34:41,"Given its extremely high performance and low production numbers, the Lamborghini Diablo is quickly becoming a highly desirable collectible car.  https://t.co/nhH4K5LDq7",en,[],[],https://twitter.com/USNewsCars/status/1508150531042295830,['https://nytv.to/6y0yo'],[],0,,0,0,0
463,1508147906477535237,gabbariele,1648405455000.0,2022-03-28 02:24:15,#PhilipKotler on Essentials of Modern #Marketing:   https://t.co/46mGzzTBWz #visualcommunicationplanner #marketingcanvas #VCP #digitalstrategy #bebrilliant #anewpathtodigital #EOMM #caterpillarbrands #books #tiktok #Danone #Lamborghini #Knauf #Clementoni #Safilo #Bauli,en,"['philipkotler', 'marketing', 'visualcommunicationplanner', 'marketingcanvas', 'vcp', 'digitalstrategy', 'bebrilliant', 'anewpathtodigital', 'eomm', 'caterpillarbrands', 'books', 'tiktok', 'danone', 'lamborghini', 'knauf', 'clementoni', 'safilo', 'bauli']",[],https://twitter.com/gabbariele/status/1508147906477535237,['https://www.tiktok.com/@gabbariele_official/video/7061577986172144902?is_copy_url=1&is_from_webapp=v1'],[],0,,0,0,0
465,1508135855730352145,hashtagutd,1648402582000.0,2022-03-28 01:36:22,"@StokesFIFA @ShaunaGames Thanks for letting us borrow your Lamborghini this week mate, okay if we drop it back tomorrow?",en,[],[],https://twitter.com/hashtagutd/status/1508135855730352145,[],[],0,,354,0,0
469,1508125130400096258,gjsvictorymma,1648400025000.0,2022-03-28 00:53:45,"Greatest Life Advice:  Don't get distracted by 🐈 ! It's the most expensive item on 🌎 . There's a poster out that shows a beautiful woman leaning on a Lamborghini and it says, ""Financial Advice, all things considered, the car is cheaper!"" 🤯",en,[],[],https://twitter.com/gjsvictorymma/status/1508125130400096258,[],[],0,,0,0,0
