,id,username,created_at,date,tweet,language,hashtags,cashtags,link,urls,photos,video,thumbnail,nlikes,nreplies,nretweets
189,1509637779818483718,gabbariele,1648760669000.0,2022-04-01 05:04:29,"Read the #casestudy of #Lamborghini in my new #book with #PhilipKotler, Denis Rothman and other gurus. We have defined the Essentials of Modern #Marketing with cases of #Danone #Knauf #iliad #Bauli and many others.  https://t.co/UjfEezjpAt #bebrilliant #EOMM #purpose #books  https://t.co/xbsLitnTIM",en,"['casestudy', 'lamborghini', 'book', 'philipkotler', 'marketing', 'danone', 'knauf', 'iliad', 'bauli', 'bebrilliant', 'eomm', 'purpose', 'books']",[],https://twitter.com/gabbariele/status/1509637779818483718,['https://eomm.bebrilliant.it/'],['https://pbs.twimg.com/media/FPNPj3MWUAAJKwv.jpg'],1,https://pbs.twimg.com/media/FPNPj3MWUAAJKwv.jpg,0,0,0
190,1509622915796459523,gabbariele,1648757125000.0,2022-04-01 04:05:25,"""Essentials of Modern Marketing is a unique book with local case studies of brilliant companies building a better world through marketing"" Gabriele Carboni. Discover the book:  https://t.co/UjfEezjpAt with cases of #Danone #Lamborghini #marketing #iliad #Knauf #PhilipKotler #EOMM  https://t.co/kegq9tGzCj",en,"['danone', 'lamborghini', 'marketing', 'iliad', 'knauf', 'philipkotler', 'eomm']",[],https://twitter.com/gabbariele/status/1509622915796459523,['https://eomm.bebrilliant.it/'],['https://pbs.twimg.com/media/FPNCCrHXEAAHKgP.jpg'],1,https://pbs.twimg.com/media/FPNCCrHXEAAHKgP.jpg,0,0,0
193,1509613388267405314,HotNewHipHop,1648754853000.0,2022-04-01 03:27:33,Nicki and Fivio were spotted riding around in a pink Lambo.  https://t.co/j4rXUCEyK5,en,[],[],https://twitter.com/HotNewHipHop/status/1509613388267405314,['https://www.hotnewhiphop.com/nicki-minaj-and-fivio-foreign-take-new-york-for-we-go-up-video-shoot-news.149871.html?utm_term=Autofeed&utm_medium=Social&utm_source=Twitter#Echobox=1648754750'],[],0,,24,0,3
195,1509603383828787206,alanrzepa,1648752468000.0,2022-04-01 02:47:48,What is it with West Ham players and crashing Lambo’s ffs,en,[],[],https://twitter.com/alanrzepa/status/1509603383828787206,[],[],0,,141,8,2
196,1509598221500305413,Lovecars,1648751237000.0,2022-04-01 02:27:17,It opens the cofango (front clamshell) and also the engine bay. The key is 3D printed by Lamborghini,en,[],[],https://twitter.com/Lovecars/status/1509598221500305413,[],[],0,,3,0,1
197,1509597507243941888,gabbariele,1648751067000.0,2022-04-01 02:24:27,#PhilipKotler on Essentials of Modern #Marketing:   https://t.co/46mGzzTBWz #visualcommunicationplanner #marketingcanvas #VCP #digitalstrategy #bebrilliant #anewpathtodigital #EOMM #caterpillarbrands #books #tiktok #Danone #Lamborghini #Knauf #Clementoni #Safilo #Bauli,en,"['philipkotler', 'marketing', 'visualcommunicationplanner', 'marketingcanvas', 'vcp', 'digitalstrategy', 'bebrilliant', 'anewpathtodigital', 'eomm', 'caterpillarbrands', 'books', 'tiktok', 'danone', 'lamborghini', 'knauf', 'clementoni', 'safilo', 'bauli']",[],https://twitter.com/gabbariele/status/1509597507243941888,['https://www.tiktok.com/@gabbariele_official/video/7061577986172144902?is_copy_url=1&is_from_webapp=v1'],[],0,,0,0,0
200,1509588008206422020,internetarchive,1648748802000.0,2022-04-01 01:46:42,"IN 2 HOURS: Join me at 1 PM PT for this introduction to Self Sovereign (#Decentralized #Identity.) It may be the future of more private, secure, user-controlled ways to log into your account. @IdentityWoman @GETJolocom @IreneAdamski  @Lambo.  👉REGISTER:  https://t.co/kSmZA8bsXi  https://t.co/5baa5A4gw8",en,"['decentralized', 'identity']",[],https://twitter.com/internetarchive/status/1509588008206422020,['https://us02web.zoom.us/webinar/register/WN_TETvI8qYTV2Cowt_JtmplQ?mc_cid=5f786dc67a&mc_eid=8c6dec5073'],['https://pbs.twimg.com/media/FPMiHzOUcAIeBcm.jpg'],1,https://pbs.twimg.com/media/FPMiHzOUcAIeBcm.jpg,12,1,5
201,1509586684777750529,robertsnellnews,1648748487000.0,2022-04-01 01:41:27,"COVID rescue cash helped fill this garage with a Lamborghini Huracan, a Porsche 911 Carrera and more, according to the feds  https://t.co/666BGVBDvf",en,[],[],https://twitter.com/robertsnellnews/status/1509586684777750529,['https://storage.courtlistener.com/recap/gov.uscourts.ilnd.413806/gov.uscourts.ilnd.413806.1.0.pdf'],[],0,,4,1,1
202,1509573553363902490,AviatorsLV,1648745356000.0,2022-04-01 00:49:16,Everyone welcome Lambo to the Aviators family! 🐶  https://t.co/UIYnedBZlB,en,[],[],https://twitter.com/AviatorsLV/status/1509573553363902490,[],[],1,https://pbs.twimg.com/ext_tw_video_thumb/1509573487450476547/pu/img/GFib0tdzpk2MWyCR.jpg,363,11,31
203,1509572871970041857,gabbariele,1648745193000.0,2022-04-01 00:46:33,"Fabrizio Gavelli, General Manager of #Danone in #Italy and #Greece on the #book Essentials of Modern #Marketing:  https://t.co/AtO916mrNH #VCP #bebrilliant #anewpathtodigital #EOMM #caterpillarbrands #books #tiktok #Lamborghini #Knauf #Clementoni #Safilo #Bauli",en,"['danone', 'italy', 'greece', 'book', 'marketing', 'vcp', 'bebrilliant', 'anewpathtodigital', 'eomm', 'caterpillarbrands', 'books', 'tiktok', 'lamborghini', 'knauf', 'clementoni', 'safilo', 'bauli']",[],https://twitter.com/gabbariele/status/1509572871970041857,['https://www.tiktok.com/@gabbariele_official/video/7063189553649306885?is_copy_url=1&is_from_webapp=v1'],[],0,,0,0,0
204,1509564462050824200,Lamborghini,1648743188000.0,2022-04-01 00:13:08,"In the second episode of our Lamborghini Style Guide we talked about shoes. Style Journalist @Teovandenbroeke gave his take on them, leaving us some important precious tips.​  #Lamborghini #HuracanSTO​  CO2 Emission and Fuel consumption Combined:  https://t.co/zr6fo0ia3H  https://t.co/AYcUTSn9YG",en,"['lamborghini', 'huracansto']",[],https://twitter.com/Lamborghini/status/1509564462050824200,['https://lam.bo/CE_Tw'],[],1,https://pbs.twimg.com/media/FPMGF-gWUA4oj2M.jpg,441,13,48
205,1509562892269543424,SunBoxing,1648742814000.0,2022-04-01 00:06:54,Conor Benn wants Amir Khan clash but veteran rival pricing himself out of fight with demands ‘for new Lamborghini’  https://t.co/mH5NSAytEV,en,[],[],https://twitter.com/SunBoxing/status/1509562892269543424,['https://www.thesun.co.uk/sport/18128642/conor-benn-amir-khan-fight-retirement/'],[],0,,0,0,5
207,1509559613041094671,CarcassGG,1648742032000.0,2022-03-31 23:53:52,"@ZikGOD @muriig0d @llissuh Yo, @ZikGOD  thanks for lending me your lambo the other day and thanks for letting me stay in the mansion with the personal gym and pool it was great cheers bro!",en,[],[],https://twitter.com/CarcassGG/status/1509559613041094671,[],[],0,,2,2,0
208,1509555285731512320,NYCCOIB,1648741000000.0,2022-03-31 23:36:40,"do you know how many reams of mid-tier copier paper it takes to buy a lamborghini?  reader, it's a lot.",en,[],[],https://twitter.com/NYCCOIB/status/1509555285731512320,[],[],0,,10,0,1
209,1509550836896219141,QuestTV,1648739940000.0,2022-03-31 23:19:00,"If there's one Lamborghini you want to uncover, it's this one! 😍  #ChasingClassicCars continues tonight at 10pm on Quest  https://t.co/j1wGY2EsiI",en,['chasingclassiccars'],[],https://twitter.com/QuestTV/status/1509550836896219141,[],[],1,https://pbs.twimg.com/media/FNa6OZwXwAY3KCY.jpg,9,1,2
211,1509532182238224384,gabbariele,1648735492000.0,2022-03-31 22:04:52,"""This book presents an up-to-date and insightful account of the working of modern marketing in today's troubled time."" #PhilpKotler. Discover the #book:  https://t.co/UjfEez1ObT with cases of #Danone #Lamborghini #marketing #iliad #Knauf #EOMM #bebrilliant #purpose #sustainability  https://t.co/wF2f4Rm1hQ",en,"['philpkotler', 'book', 'danone', 'lamborghini', 'marketing', 'iliad', 'knauf', 'eomm', 'bebrilliant', 'purpose', 'sustainability']",[],https://twitter.com/gabbariele/status/1509532182238224384,['https://eomm.bebrilliant.it/'],['https://pbs.twimg.com/media/FPLvhRhVUAAOBEJ.jpg'],1,https://pbs.twimg.com/media/FPLvhRhVUAAOBEJ.jpg,0,0,0
212,1509524473183182849,USNewsCars,1648733654000.0,2022-03-31 21:34:14,"Given its extremely high performance and low production numbers, the Lamborghini Diablo is quickly becoming a highly desirable collectible car.  https://t.co/eCoAnbpiON",en,[],[],https://twitter.com/USNewsCars/status/1509524473183182849,['https://nytv.to/5zDBA'],[],0,,0,0,0
217,1509472474680942592,russburlingame,1648721257000.0,2022-03-31 18:07:37,"Reading the quotes, this guy sounds EXACTLY like somebody who drives a Lamborghini and offers reward money in crypto.",en,[],[],https://twitter.com/russburlingame/status/1509472474680942592,[],[],0,,2,0,0
218,1509463550124769286,FazeMiyake,1648719129000.0,2022-03-31 17:32:09,Have you considered that everyone rents Lambo for their vid so it’s not really separating you or getting you noticed? Just saying. Could save a few bob doing the video brother. Gotta captivate the audience man…,en,[],[],https://twitter.com/FazeMiyake/status/1509463550124769286,[],[],0,,33,1,4
219,1509461613199429639,gabbariele,1648718667000.0,2022-03-31 17:24:27,Highlights of the launching event of Essentials of Modern #Marketing:  https://t.co/GSSRgXXkkw #visualcommunicationplanner #marketingcanvas #VCP #digitalstrategy #bebrilliant #anewpathtodigital #EOMM #caterpillarbrands #books #tiktok #Danone #Lamborghini #Knauf #Clementoni #hfarm,en,"['marketing', 'visualcommunicationplanner', 'marketingcanvas', 'vcp', 'digitalstrategy', 'bebrilliant', 'anewpathtodigital', 'eomm', 'caterpillarbrands', 'books', 'tiktok', 'danone', 'lamborghini', 'knauf', 'clementoni', 'hfarm']",[],https://twitter.com/gabbariele/status/1509461613199429639,['https://www.tiktok.com/@gabbariele_official/video/7061893180991622406?is_copy_url=1&is_from_webapp=v1'],[],0,,0,0,0
221,1509450090821431298,Lamborghini,1648715920000.0,2022-03-31 16:38:40,"Lamborghini Countach LEGO Speed Champions is a realistic @LEGO_Group adaptation of the famed Super Sports Car. Have fun building it, have even more fun playing with it. One thing is certain, it makes for an awesome gift.   #Lamborghini #Countach #LEGO  https://t.co/n08YIkm3X0",en,"['lamborghini', 'countach', 'lego']",[],https://twitter.com/Lamborghini/status/1509450090821431298,[],"['https://pbs.twimg.com/media/FPKkrykXwAIF-Sv.jpg', 'https://pbs.twimg.com/media/FPKkr1UXIAMIZsN.jpg', 'https://pbs.twimg.com/media/FPKkr2XXIAUL_4w.jpg']",1,https://pbs.twimg.com/media/FPKkrykXwAIF-Sv.jpg,757,12,81
223,1509447241253199872,FivioForeign,1648715241000.0,2022-03-31 16:27:21,Me sitting on Top of Nicci pink Lambo in the middle of Queens 🔥,en,[],[],https://twitter.com/FivioForeign/status/1509447241253199872,[],[],0,,7768,117,830
225,1509439565941067779,alistairmilne,1648713411000.0,2022-03-31 15:56:51,Them: Why don't you change your profile photo? Why do you wear a shitty watch? Why don't you have a Lambo? Why don't you go to #Bitcoin events?  Me:  https://t.co/l5rpXR30vq,en,['bitcoin'],[],https://twitter.com/alistairmilne/status/1509439565941067779,['https://www.zerohedge.com/markets/33-year-old-crypto-expert-shot-5-times-point-blank-range-nyc-attempt-steal-his-450000'],[],0,,253,37,35
226,1509419853488308226,gabbariele,1648708711000.0,2022-03-31 14:38:31,Get a free sample of my new #book with #PhilipKotler - Denis Rothman and other gurus. We have defined the Essentials of Modern #Marketing with cases of #Danone #Lamborghini #Knauf #iliad #Bauli and many others.  https://t.co/UjfEezjpAt #bebrilliant #EOMM #purpose  https://t.co/f6OAip4M8u,en,"['book', 'philipkotler', 'marketing', 'danone', 'lamborghini', 'knauf', 'iliad', 'bauli', 'bebrilliant', 'eomm', 'purpose']",[],https://twitter.com/gabbariele/status/1509419853488308226,['https://eomm.bebrilliant.it/'],['https://pbs.twimg.com/media/FPKJW4nXsAQX2k5.png'],1,https://pbs.twimg.com/media/FPKJW4nXsAQX2k5.png,0,0,0
230,1509364903013859332,BenjaminEnfield,1648695610000.0,2022-03-31 11:00:10,"🚨🚨Latto Brags About Lamborghini, Birkins, Richard Mille Watch Gifts From Her BF  https://t.co/JX1jzqqtbY 🚨🚨",en,[],[],https://twitter.com/BenjaminEnfield/status/1509364903013859332,['https://nowhiphopnews.com/latto-brags-about-lamborghini-birkins-richard-mille-watch-gifts-from-her-bf/'],[],0,,2,1,1
231,1509355554149441539,CountDankulaTV,1648693381000.0,2022-03-31 10:23:01,"@jook132 I bought 30 trillion fuckboi coin that was made by an anonymous team from the Philippines and didn't have enough for a Lambo in 5 minutes, crypto is clearly a scam.",en,[],[],https://twitter.com/CountDankulaTV/status/1509355554149441539,[],[],0,,15,4,1
232,1509334693090635776,PUBGMOBILE,1648688407000.0,2022-03-31 09:00:07,Loving the PUBGMOBILE x Lamborghini Collab? 😍   Screenshot 📸 these mobile backgrounds! 📲   Which one of these is your favorite? 💚 🖤 💛    https://t.co/7yVBd2u0x9  #PUBGMOBILE #Lamborghini #URUS #Estoque #AventadorSVJ  https://t.co/NWMaGNbH1P,en,"['pubgmobile', 'lamborghini', 'urus', 'estoque', 'aventadorsvj']",[],https://twitter.com/PUBGMOBILE/status/1509334693090635776,['https://pubgmobile.live/Lamborghini'],"['https://pbs.twimg.com/media/FPI75LtXsAETvRC.jpg', 'https://pbs.twimg.com/media/FPI75bKXoAkOEV9.jpg', 'https://pbs.twimg.com/media/FPI75woXEAQuoh1.jpg']",1,https://pbs.twimg.com/media/FPI75LtXsAETvRC.jpg,311,50,16
233,1509320327280852995,adam_turner,1648684982000.0,2022-03-31 08:03:02,"Was behind a Lamborghini Countach driving like an arsehole in a 40 zone - getting right behind people and reviving the engine. Took a sharp corner, saw their phone fall out the window and slide across the road into a drain. Hopefully they’ll tear the car apart looking for it ;-)  https://t.co/8AfSICw1gD",en,[],[],https://twitter.com/adam_turner/status/1509320327280852995,[],['https://pbs.twimg.com/media/FPIu1nzagAQKVaE.jpg'],1,https://pbs.twimg.com/media/FPIu1nzagAQKVaE.jpg,10,2,0
234,1509318549814362118,PalmerLuckey,1648684558000.0,2022-03-31 07:55:58,"@Thrilluwu People would rather test drive a Lambo over a Toyota, few would ever buy one though.",en,[],[],https://twitter.com/PalmerLuckey/status/1509318549814362118,[],[],0,,66,4,0
235,1509316160415678464,heffeln,1648683989000.0,2022-03-31 07:46:29,Found out today that people have donated some pretty cool cars to @CPRNews  --like a Lamborghini and even a Tesla! Do YOU have a car you want to donate to keep CPR going strong? (even if its a sweet Buick Park Avenue...) check out this link --  https://t.co/nn9jBhZVek,en,[],[],https://twitter.com/heffeln/status/1509316160415678464,['https://www.cpr.org/support/vehicle-donations/'],[],0,,4,0,0
236,1509312227756625925,maxniederhofer,1648683051000.0,2022-03-31 07:30:51,@DanielleMorrill @ealexhudson never you mind make me rich lambo girl  https://t.co/hwzMWHQTWT,en,[],[],https://twitter.com/maxniederhofer/status/1509312227756625925,[],['https://pbs.twimg.com/media/FPIneJXXoAssqCk.jpg'],1,https://pbs.twimg.com/media/FPIneJXXoAssqCk.jpg,3,1,0
237,1509289035306569743,gabbariele,1648677521000.0,2022-03-31 05:58:41,"Read the #casestudy of #Danone in my new #book with #PhilipKotler, Denis Rothman and other gurus. We have defined the Essentials of Modern #Marketing with cases of #Lamborghini #Knauf #iliad #Bauli and many others.  https://t.co/UjfEezjpAt #bebrilliant #EOMM #purpose #books  https://t.co/1McYepsBzu",en,"['casestudy', 'danone', 'book', 'philipkotler', 'marketing', 'lamborghini', 'knauf', 'iliad', 'bauli', 'bebrilliant', 'eomm', 'purpose', 'books']",[],https://twitter.com/gabbariele/status/1509289035306569743,['https://eomm.bebrilliant.it/'],['https://pbs.twimg.com/media/FPISYQ0XoAYCGrC.jpg'],1,https://pbs.twimg.com/media/FPISYQ0XoAYCGrC.jpg,0,0,0
238,1509277664732975107,alanisnking,1648674810000.0,2022-03-31 05:13:30,"I feel like if I put a few stickers on my Lamborghini Huracan STO next week, I could realistically tell people I’m racing in the Long Beach Grand Prix",en,[],[],https://twitter.com/alanisnking/status/1509277664732975107,[],[],0,,116,9,0
239,1509275438081847297,gabbariele,1648674280000.0,2022-03-31 05:04:40,"Read the #casestudy of #Lamborghini in my new #book with #PhilipKotler, Denis Rothman and other gurus. We have defined the Essentials of Modern #Marketing with cases of #Danone #Knauf #iliad #Bauli and many others.  https://t.co/UjfEezjpAt #bebrilliant #EOMM #purpose #books  https://t.co/HFI5MCtQ6n",en,"['casestudy', 'lamborghini', 'book', 'philipkotler', 'marketing', 'danone', 'knauf', 'iliad', 'bauli', 'bebrilliant', 'eomm', 'purpose', 'books']",[],https://twitter.com/gabbariele/status/1509275438081847297,['https://eomm.bebrilliant.it/'],['https://pbs.twimg.com/media/FPIGAziXMAgxN3F.jpg'],1,https://pbs.twimg.com/media/FPIGAziXMAgxN3F.jpg,0,0,0
240,1509275395199283201,gabbariele,1648674269000.0,2022-03-31 05:04:29,"Read the #casestudy of #Lamborghini in my new #book with #PhilipKotler, Denis Rothman and other gurus. We have defined the Essentials of Modern #Marketing with cases of #Danone #Knauf #iliad #Bauli and many others.  https://t.co/UjfEezjpAt #bebrilliant #EOMM #purpose #books  https://t.co/FG4mHsKvzc",en,"['casestudy', 'lamborghini', 'book', 'philipkotler', 'marketing', 'danone', 'knauf', 'iliad', 'bauli', 'bebrilliant', 'eomm', 'purpose', 'books']",[],https://twitter.com/gabbariele/status/1509275395199283201,['https://eomm.bebrilliant.it/'],['https://pbs.twimg.com/media/FPIF-RBXwAkQVju.jpg'],1,https://pbs.twimg.com/media/FPIF-RBXwAkQVju.jpg,0,0,0
241,1509274303803518977,BenjaminEnfield,1648674009000.0,2022-03-31 05:00:09,"🚨🚨Latto Brags About Lamborghini, Birkins, Richard Mille Watch Gifts From Her BF  https://t.co/JX1jzqqtbY",en,[],[],https://twitter.com/BenjaminEnfield/status/1509274303803518977,['https://nowhiphopnews.com/latto-brags-about-lamborghini-birkins-richard-mille-watch-gifts-from-her-bf/'],[],0,,6,1,0
243,1509264870331539460,ROOTCatZ,1648671760000.0,2022-03-31 04:22:40,Final Logo #CCW GOAT &amp; The Gang Serral - Bunny - Lambo - Armani - DnS  https://t.co/kEQMIPfnCW,en,['ccw'],[],https://twitter.com/ROOTCatZ/status/1509264870331539460,[],['https://pbs.twimg.com/media/FPH8HthWUAURw51.jpg'],1,https://pbs.twimg.com/media/FPH8HthWUAURw51.jpg,75,3,0
244,1509262170307059714,muratpak,1648671116000.0,2022-03-31 04:11:56,"But hey, don't ask me for your gas fees wen you lambo. 🚗",en,[],[],https://twitter.com/muratpak/status/1509262170307059714,[],[],0,,376,57,22
246,1509259823858212869,gabbariele,1648670557000.0,2022-03-31 04:02:37,"""Essentials of Modern Marketing is a unique book with local case studies of brilliant companies building a better world through marketing"" Gabriele Carboni. Discover the book:  https://t.co/UjfEezjpAt with cases of #Danone #Lamborghini #marketing #iliad #Knauf #PhilipKotler #EOMM  https://t.co/hNj9YEsHNf",en,"['danone', 'lamborghini', 'marketing', 'iliad', 'knauf', 'philipkotler', 'eomm']",[],https://twitter.com/gabbariele/status/1509259823858212869,['https://eomm.bebrilliant.it/'],['https://pbs.twimg.com/media/FPH3z7uXMAIT6q8.jpg'],1,https://pbs.twimg.com/media/FPH3z7uXMAIT6q8.jpg,0,0,0
252,1509244072657137664,EpicGames,1648666801000.0,2022-03-31 03:00:01,The @Lamborghini Countach LPI 800-4 is now in @RocketLeague.  Find it in the Item Shop!  https://t.co/q11aKTEibW,en,[],[],https://twitter.com/EpicGames/status/1509244072657137664,[],['https://pbs.twimg.com/media/FPHI3VcVQAE6nqU.jpg'],1,https://pbs.twimg.com/media/FPHI3VcVQAE6nqU.jpg,435,13,26
253,1509236977207455745,MedalCore,1648665110000.0,2022-03-31 02:31:50,Lambo Giveaway soon 👀  Turn on tweet notifications to be the first one to know when it goes live!,en,[],[],https://twitter.com/MedalCore/status/1509236977207455745,[],[],0,,67,11,8
254,1509235134674915331,gabbariele,1648664670000.0,2022-03-31 02:24:30,#PhilipKotler on Essentials of Modern #Marketing:   https://t.co/46mGzzTBWz #visualcommunicationplanner #marketingcanvas #VCP #digitalstrategy #bebrilliant #anewpathtodigital #EOMM #caterpillarbrands #books #tiktok #Danone #Lamborghini #Knauf #Clementoni #Safilo #Bauli,en,"['philipkotler', 'marketing', 'visualcommunicationplanner', 'marketingcanvas', 'vcp', 'digitalstrategy', 'bebrilliant', 'anewpathtodigital', 'eomm', 'caterpillarbrands', 'books', 'tiktok', 'danone', 'lamborghini', 'knauf', 'clementoni', 'safilo', 'bauli']",[],https://twitter.com/gabbariele/status/1509235134674915331,['https://www.tiktok.com/@gabbariele_official/video/7061577986172144902?is_copy_url=1&is_from_webapp=v1'],[],0,,0,0,0
255,1509234838808797197,amustycow,1648664600000.0,2022-03-31 02:23:20,@iDazerin nah bro that’s all you. thanks for hooking me up with the mansion and lambo btw 🙏🙏,en,[],[],https://twitter.com/amustycow/status/1509234838808797197,[],[],0,,380,2,0
258,1509230213481345031,MaximMag,1648663497000.0,2022-03-31 02:04:57,"The Lotus Eletre may look a lot like the Lamborghini Urus, but it's even quicker and absolutely emissions-free.  https://t.co/iF7E10BuXw",en,[],[],https://twitter.com/MaximMag/status/1509230213481345031,['https://www.maxim.com/rides/lotus-unveils-all-electric-600-hp-hyper-suv/'],[],0,,5,1,0
259,1509229864376840200,McLandoTwitch,1648663414000.0,2022-03-31 02:03:34,@ian_nowakowski I left with a brand new Lamborghini. Thanks again btw!,en,[],[],https://twitter.com/McLandoTwitch/status/1509229864376840200,[],[],0,,4,1,0
260,1509228452091772933,alanisnking,1648663077000.0,2022-03-31 01:57:57,"Telling @BoziTatarevic that I can pick up him, but not his suitcase, from LAX in the Lamborghini Huracan STO next week",en,[],[],https://twitter.com/alanisnking/status/1509228452091772933,[],[],0,,101,11,1
261,1509214586087612422,benmezrich,1648659771000.0,2022-03-31 01:02:51,Bitcoin Billy debuting just in time for Bitcoin Miami. No self respecting bitcoiner will be able to resist. When Lambo? :)  https://t.co/awPK6lGGdj,en,[],[],https://twitter.com/benmezrich/status/1509214586087612422,[],['https://pbs.twimg.com/media/FPHOqqBWUAENdNe.jpg'],1,https://pbs.twimg.com/media/FPHOqqBWUAENdNe.jpg,38,6,6
263,1509212864271245323,joelfeder,1648659361000.0,2022-03-31 00:56:01,"Was offline in the middle of nowhere Texas most of yesterday, but Lotus unveiled an electric crossover SUV… everything is upside down.   Probably drives great. Looks like a Lambo. Wonder how simple and light it is…",en,[],[],https://twitter.com/joelfeder/status/1509212864271245323,[],[],0,,0,0,0
264,1509211603891212290,AlexKalogiannis,1648659060000.0,2022-03-31 00:51:00,"@AutowriterDan @Lamborghini I keep forgetting to tell Lambo I’d like to drive this. Well, ask very nicely, I should say. 😬",en,[],[],https://twitter.com/AlexKalogiannis/status/1509211603891212290,[],[],0,,1,0,0
265,1509210470045163521,gabbariele,1648658790000.0,2022-03-31 00:46:30,"Fabrizio Gavelli, General Manager of #Danone in #Italy and #Greece on the #book Essentials of Modern #Marketing:  https://t.co/AtO916mrNH #VCP #bebrilliant #anewpathtodigital #EOMM #caterpillarbrands #books #tiktok #Lamborghini #Knauf #Clementoni #Safilo #Bauli",en,"['danone', 'italy', 'greece', 'book', 'marketing', 'vcp', 'bebrilliant', 'anewpathtodigital', 'eomm', 'caterpillarbrands', 'books', 'tiktok', 'lamborghini', 'knauf', 'clementoni', 'safilo', 'bauli']",[],https://twitter.com/gabbariele/status/1509210470045163521,['https://www.tiktok.com/@gabbariele_official/video/7063189553649306885?is_copy_url=1&is_from_webapp=v1'],[],0,,0,0,0
266,1509209449575104515,myfox8,1648658547000.0,2022-03-31 00:42:27,"6-year-old starts tie dye business to donate to charity, save for Lamborghini  https://t.co/JuTdX2FkCo  https://t.co/C0PZ2E7hVc",en,[],[],https://twitter.com/myfox8/status/1509209449575104515,['https://trib.al/OelM8zB'],['https://pbs.twimg.com/media/FPHJ_vAXoAgZq71.jpg'],1,https://pbs.twimg.com/media/FPHJ_vAXoAgZq71.jpg,5,0,1
270,1509203261437497345,Lamborghini,1648657071000.0,2022-03-31 00:17:51,A new challenger enters @RocketLeague. New Countach LPI 800-4 is bringing Lamborghini’s signature flare and elegance to the massively popular game.     #Lamborghini #RocketLeague #Countach #FutureIsOurLegacy    CO2 Emission and Fuel consumption Combined:  https://t.co/fU04Nb7RIb,en,"['lamborghini', 'rocketleague', 'countach', 'futureisourlegacy']",[],https://twitter.com/Lamborghini/status/1509203261437497345,['http://lam.bo/CE_Tw'],[],0,,729,18,91
271,1509203130248048640,RocketLeague,1648657040000.0,2022-03-31 00:17:20,The @Lamborghini Countach LPI 800-4 is now in Rocket League.   Find it in the Item Shop!  https://t.co/4hJ0u0Z87b,en,[],[],https://twitter.com/RocketLeague/status/1509203130248048640,[],['https://pbs.twimg.com/media/FPHA27gXEAMt75Q.jpg'],1,https://pbs.twimg.com/media/FPHA27gXEAMt75Q.jpg,1616,96,115
272,1509199602444025866,USNewsCars,1648656199000.0,2022-03-31 00:03:19,"Given its extremely high performance and low production numbers, the Lamborghini Diablo is quickly becoming a highly desirable collectible car.  https://t.co/HPvLi5xc7k",en,[],[],https://twitter.com/USNewsCars/status/1509199602444025866,['https://nytv.to/6y0PG'],[],0,,0,0,0
275,1509183743340466178,TopGearMagIndia,1648652418000.0,2022-03-30 23:00:18,Our second-anniversary issue is inching closer to its release but wait! A Lamborghini Huracan EVO Fluo Capsule on a freaking dragstrip isn’t our cover either?  Spoiler alert: The actual cover will indeed feature an exotic supercar and an elusive racetrack.   #lamborghinihuracan  https://t.co/j12bvqhrbp,en,['lamborghinihuracan'],[],https://twitter.com/TopGearMagIndia/status/1509183743340466178,[],['https://pbs.twimg.com/media/FPGynF1aMAQO9Ce.jpg'],1,https://pbs.twimg.com/media/FPGynF1aMAQO9Ce.jpg,7,0,7
277,1509175548723011596,NationalFM3,1648650464000.0,2022-03-30 22:27:44,Tune in for #AlbumLaunch tonight at 1900hrs with  Ishe Lambo hosted by @sir ezraldo  https://t.co/CzZHD9cX8n,en,['albumlaunch'],[],https://twitter.com/NationalFM3/status/1509175548723011596,[],['https://pbs.twimg.com/media/FPGrKb5WQAYksbf.jpg'],1,https://pbs.twimg.com/media/FPGrKb5WQAYksbf.jpg,3,1,1
