,id,username,created_at,date,tweet,language,hashtags,cashtags,link,urls,photos,video,thumbnail,nlikes,nreplies,nretweets
278,1509169311788802050,gabbariele,1648648977000.0,2022-03-30 22:02:57,"""This book presents an up-to-date and insightful account of the working of modern marketing in today's troubled time."" #PhilpKotler. Discover the #book:  https://t.co/UjfEezjpAt with cases of #Danone #Lamborghini #marketing #iliad #Knauf #EOMM #bebrilliant #purpose #sustainability  https://t.co/yVbyJCfAgT",en,"['philpkotler', 'book', 'danone', 'lamborghini', 'marketing', 'iliad', 'knauf', 'eomm', 'bebrilliant', 'purpose', 'sustainability']",[],https://twitter.com/gabbariele/status/1509169311788802050,['https://eomm.bebrilliant.it/'],['https://pbs.twimg.com/media/FPGlfcPWYAUPYyf.jpg'],1,https://pbs.twimg.com/media/FPGlfcPWYAUPYyf.jpg,0,0,0
279,1509158834455162889,RL_Support,1648646479000.0,2022-03-30 21:21:19,"@AM562onXbox Hey Andrew, thanks for taking the time to reach out to us about this. The Lamborghini Countach bundle will be available later today. You can find out more about the launch date here:  https://t.co/7eWMnvJNTw. Thanks!",en,[],[],https://twitter.com/RL_Support/status/1509158834455162889,['https://bit.ly/3JUYycW'],[],0,,1,0,0
286,1509115531831435264,WilkinLee,1648636155000.0,2022-03-30 18:29:15,@Mobile_Dom Yeah this looks terrible... they should have gone full urus on it like Lambo.,en,[],[],https://twitter.com/WilkinLee/status/1509115531831435264,[],[],0,,1,0,0
287,1509115527851134979,Lamborghini,1648636154000.0,2022-03-30 18:29:14,This weekend the legendary Imola circuit will host the 14th edition of the Lamborghini Super Trofeo of @Lamborghinisc. The competition will see the debut of the new Lamborghini Huracán Super Trofeo EVO2 and of Moto GP legend @26_DaniPedrosa. ​  #Lamborghini #LamborghiniSC,en,"['lamborghini', 'lamborghinisc']",[],https://twitter.com/Lamborghini/status/1509115527851134979,[],[],0,,500,6,54
288,1509099304811646979,gabbariele,1648632286000.0,2022-03-30 17:24:46,Highlights of the launching event of Essentials of Modern #Marketing:  https://t.co/GSSRgXXkkw #visualcommunicationplanner #marketingcanvas #VCP #digitalstrategy #bebrilliant #anewpathtodigital #EOMM #caterpillarbrands #books #tiktok #Danone #Lamborghini #Knauf #Clementoni #hfarm,en,"['marketing', 'visualcommunicationplanner', 'marketingcanvas', 'vcp', 'digitalstrategy', 'bebrilliant', 'anewpathtodigital', 'eomm', 'caterpillarbrands', 'books', 'tiktok', 'danone', 'lamborghini', 'knauf', 'clementoni', 'hfarm']",[],https://twitter.com/gabbariele/status/1509099304811646979,['https://www.tiktok.com/@gabbariele_official/video/7061893180991622406?is_copy_url=1&is_from_webapp=v1'],[],0,,0,0,0
289,1509095061539143682,LamborghiniSC,1648631274000.0,2022-03-30 17:07:54,"The iconic Italian circuit of @autodromoimola  will host the opening round of the 2022 #Lamborghini Super Trofeo Europe season, the 14th edition of the one-make GT championship.  https://t.co/PalcUJdsGy",en,['lamborghini'],[],https://twitter.com/LamborghiniSC/status/1509095061539143682,['https://www.lamborghini.com/en-en/motorsport/news/lamborghini-super-trofeo-europe-imola-hosts-season-opener-and-debut-of-the-huracan-st-evo2'],[],0,,25,0,3
290,1509093109157666818,BenjaminEnfield,1648630809000.0,2022-03-30 17:00:09,"🚨Latto Brags About Lamborghini, Birkins, Richard Mille Watch Gifts From Her BF  https://t.co/JX1jzqqtbY",en,[],[],https://twitter.com/BenjaminEnfield/status/1509093109157666818,['https://nowhiphopnews.com/latto-brags-about-lamborghini-birkins-richard-mille-watch-gifts-from-her-bf/'],[],0,,0,0,1
291,1509078082312880129,thedrive,1648627226000.0,2022-03-30 16:00:26,Is this what happens when you order a Lambo off of Wish?  https://t.co/MjkttSozMc,en,[],[],https://twitter.com/thedrive/status/1509078082312880129,['https://www.thedrive.com/news/44958/this-horrid-honda-civic-is-the-lamborghini-aventador-we-have-at-home'],[],0,,4,0,1
292,1509073314001604608,AdamHayNicholls,1648626089000.0,2022-03-30 15:41:29,"Lotus launched its first SUV last night, the all-electric Eletre. Looks like a Kia EV6 humped a Lamborghini Urus, which isn’t a bad thing. Is Colin Chapman spinning in his grave? I think he’d enjoy the money. #LotusEletre @lotuscars  https://t.co/hcTTSjIQ6Z",en,['lotuseletre'],[],https://twitter.com/AdamHayNicholls/status/1509073314001604608,[],"['https://pbs.twimg.com/media/FPFOLXHWQAAs2yV.jpg', 'https://pbs.twimg.com/media/FPFOLXHXMAAIIN7.jpg']",1,https://pbs.twimg.com/media/FPFOLXHWQAAs2yV.jpg,1,2,0
293,1509057467669491714,gabbariele,1648622311000.0,2022-03-30 14:38:31,Get a free sample of my new #book with #PhilipKotler - Denis Rothman and other gurus. We have defined the Essentials of Modern #Marketing with cases of #Danone #Lamborghini #Knauf #iliad #Bauli and many others.  https://t.co/UjfEezjpAt #bebrilliant #EOMM #purpose  https://t.co/xIIAc13fZx,en,"['book', 'philipkotler', 'marketing', 'danone', 'lamborghini', 'knauf', 'iliad', 'bauli', 'bebrilliant', 'eomm', 'purpose']",[],https://twitter.com/gabbariele/status/1509057467669491714,['https://eomm.bebrilliant.it/'],['https://pbs.twimg.com/media/FPE_xSuXoAIJIP-.png'],1,https://pbs.twimg.com/media/FPE_xSuXoAIJIP-.png,0,0,0
294,1509021874818203649,NewsyNick,1648613825000.0,2022-03-30 12:17:05,"@firstadopter That’s like two Lamborghinis, and I’ve never seen a Lamborghini ad on Twitter (but maybe I will after this tweet)",en,[],[],https://twitter.com/NewsyNick/status/1509021874818203649,[],[],0,,1,0,0
295,1508978932594274305,internetarchive,1648603587000.0,2022-03-30 09:26:27,"3/ THIS THURS 3/31: Join us for an intro to #Decentralized Identity, and how this area of tech may help us keep our personal data, well...personal.  Hear from experts @whanamura @IdentityWoman, @lambo @GETJolocom's @IreneAdamski.  REGISTER:  https://t.co/kSmZA8bsXi #SelfSovereign  https://t.co/2dzxMKodgK",en,"['decentralized', 'selfsovereign']",[],https://twitter.com/internetarchive/status/1508978932594274305,['https://us02web.zoom.us/webinar/register/WN_TETvI8qYTV2Cowt_JtmplQ?mc_cid=5f786dc67a&mc_eid=8c6dec5073'],['https://pbs.twimg.com/media/FPD1jKKUcAEICZY.jpg'],1,https://pbs.twimg.com/media/FPD1jKKUcAEICZY.jpg,10,1,6
296,1508973076230385668,USNewsCars,1648602191000.0,2022-03-30 09:03:11,"Given its extremely high performance and low production numbers, the Lamborghini Diablo is quickly becoming a highly desirable collectible car.  https://t.co/s9g9KYjT4t",en,[],[],https://twitter.com/USNewsCars/status/1508973076230385668,['https://nytv.to/1kQ3E'],[],0,,0,0,0
298,1508950994754834433,RDRv3,1648596926000.0,2022-03-30 07:35:26,pretty sure that's a lambo dude  https://t.co/NRDSjpfS4l,en,[],[],https://twitter.com/RDRv3/status/1508950994754834433,['https://jalopnik.com/2023-lotus-eletre-this-is-it-1848721470'],[],0,,11,1,0
299,1508926622010908673,gabbariele,1648591115000.0,2022-03-30 05:58:35,"Read the #casestudy of #Danone in my new #book with #PhilipKotler, Denis Rothman and other gurus. We have defined the Essentials of Modern #Marketing with cases of #Lamborghini #Knauf #iliad #Bauli and many others.  https://t.co/UjfEezjpAt #bebrilliant #EOMM #purpose #books  https://t.co/NzCwihxHCN",en,"['casestudy', 'danone', 'book', 'philipkotler', 'marketing', 'lamborghini', 'knauf', 'iliad', 'bauli', 'bebrilliant', 'eomm', 'purpose', 'books']",[],https://twitter.com/gabbariele/status/1508926622010908673,['https://eomm.bebrilliant.it/'],['https://pbs.twimg.com/media/FPDIxARWYAkJx53.jpg'],1,https://pbs.twimg.com/media/FPDIxARWYAkJx53.jpg,2,0,0
300,1508913134731509765,gabbariele,1648587900000.0,2022-03-30 05:05:00,"Read the #casestudy of #Lamborghini in my new #book with #PhilipKotler, Denis Rothman and other gurus. We have defined the Essentials of Modern #Marketing with cases of #Danone #Knauf #iliad #Bauli and many others.  https://t.co/UjfEezjpAt #bebrilliant #EOMM #purpose #books  https://t.co/13MupCFG1c",en,"['casestudy', 'lamborghini', 'book', 'philipkotler', 'marketing', 'danone', 'knauf', 'iliad', 'bauli', 'bebrilliant', 'eomm', 'purpose', 'books']",[],https://twitter.com/gabbariele/status/1508913134731509765,['https://eomm.bebrilliant.it/'],['https://pbs.twimg.com/media/FPC8f7iXIAIJ5Sh.jpg'],1,https://pbs.twimg.com/media/FPC8f7iXIAIJ5Sh.jpg,0,0,0
301,1508913107296526340,gabbariele,1648587893000.0,2022-03-30 05:04:53,"Read the #casestudy of #Lamborghini in my new #book with #PhilipKotler, Denis Rothman and other gurus. We have defined the Essentials of Modern #Marketing with cases of #Danone #Knauf #iliad #Bauli and many others.  https://t.co/UjfEezjpAt #bebrilliant #EOMM #purpose #books  https://t.co/c8kRJmfMRu",en,"['casestudy', 'lamborghini', 'book', 'philipkotler', 'marketing', 'danone', 'knauf', 'iliad', 'bauli', 'bebrilliant', 'eomm', 'purpose', 'books']",[],https://twitter.com/gabbariele/status/1508913107296526340,['https://eomm.bebrilliant.it/'],['https://pbs.twimg.com/media/FPC8eXMXoAkVBfw.jpg'],1,https://pbs.twimg.com/media/FPC8eXMXoAkVBfw.jpg,0,0,0
302,1508906271553904641,TyagiKonark,1648586263000.0,2022-03-30 04:37:43,@MKBHD @dennisrodman what Lamborghini was it?,en,[],[],https://twitter.com/TyagiKonark/status/1508906271553904641,[],[],0,,0,0,0
304,1508899614451281928,kiruti,1648584676000.0,2022-03-30 04:11:16,Lotus Eletre looks like an electric Lamborghini Urus,en,[],[],https://twitter.com/kiruti/status/1508899614451281928,[],[],0,,1,0,0
305,1508897146019450890,gabbariele,1648584088000.0,2022-03-30 04:01:28,"""Essentials of Modern Marketing is a unique book with local case studies of brilliant companies building a better world through marketing"" Gabriele Carboni. Discover the book:  https://t.co/UjfEezjpAt with cases of #Danone #Lamborghini #marketing #iliad #Knauf #PhilipKotler #EOMM  https://t.co/aAlPs9d2Hq",en,"['danone', 'lamborghini', 'marketing', 'iliad', 'knauf', 'philipkotler', 'eomm']",[],https://twitter.com/gabbariele/status/1508897146019450890,['https://eomm.bebrilliant.it/'],['https://pbs.twimg.com/media/FPCt9UaWQAIdPjf.jpg'],1,https://pbs.twimg.com/media/FPCt9UaWQAIdPjf.jpg,0,0,0
306,1508889227051745285,AutoExpress,1648582200000.0,2022-03-30 03:30:00,Electric or ICE? Would you pick the new Lotus Eletre SUV over a Lamborghini Urus? &gt;&gt;  https://t.co/0U6uPuoa0u  https://t.co/2W9U8Zhv7m,en,[],[],https://twitter.com/AutoExpress/status/1508889227051745285,['http://aex.ae/3NHSfMr'],['https://pbs.twimg.com/media/FPCleVVXIAkMrXm.jpg'],1,https://pbs.twimg.com/media/FPCleVVXIAkMrXm.jpg,31,11,6
307,1508888198226878466,omaakatugba,1648581954000.0,2022-03-30 03:25:54,You know say Lamborghini dey very attractive. E no dir pass you make you no Look.,en,[],[],https://twitter.com/omaakatugba/status/1508888198226878466,[],[],0,,3,1,0
308,1508886641972293646,HOT97,1648581583000.0,2022-03-30 03:19:43,"Latto brags about the Lamborghini, the Corvette and more gifts that her man got her!  Here's why fans think she's dating 21 Savage:  https://t.co/F8EI8DdyCW",en,[],[],https://twitter.com/HOT97/status/1508886641972293646,['https://www.hot97.com/hip-hop-news/hot-news/latto-brags-about-gifts-her-boyfriend-got-her-fans-speculate-shes-dating-21-savage/'],[],0,,14,2,1
309,1508886480009244676,omaakatugba,1648581545000.0,2022-03-30 03:19:05,Ghana’s goalkeeper saved them but ours let us down. We had a Lamborghini  but we wanted a Fiat. A typical Nigerian mentality. We got it. Akwaba!!,en,[],[],https://twitter.com/omaakatugba/status/1508886480009244676,[],[],0,,634,90,138
312,1508874786079973393,YahooFinance,1648578757000.0,2022-03-30 02:32:37,.@Lamborghini Chairman and CEO Stephan Winkelmann discusses the company's new line of hybrid vehicles.  https://t.co/eZe91fvi4O,en,[],[],https://twitter.com/YahooFinance/status/1508874786079973393,[],[],1,https://pbs.twimg.com/media/FPCY5LzXwAMPMCz.jpg,9,2,4
313,1508872756435300352,gabbariele,1648578273000.0,2022-03-30 02:24:33,#PhilipKotler on Essentials of Modern #Marketing:   https://t.co/46mGzzTBWz #visualcommunicationplanner #marketingcanvas #VCP #digitalstrategy #bebrilliant #anewpathtodigital #EOMM #caterpillarbrands #books #tiktok #Danone #Lamborghini #Knauf #Clementoni #Safilo #Bauli,en,"['philipkotler', 'marketing', 'visualcommunicationplanner', 'marketingcanvas', 'vcp', 'digitalstrategy', 'bebrilliant', 'anewpathtodigital', 'eomm', 'caterpillarbrands', 'books', 'tiktok', 'danone', 'lamborghini', 'knauf', 'clementoni', 'safilo', 'bauli']",[],https://twitter.com/gabbariele/status/1508872756435300352,['https://www.tiktok.com/@gabbariele_official/video/7061577986172144902?is_copy_url=1&is_from_webapp=v1'],[],0,,0,0,0
315,1508856433235873797,thedrive,1648574381000.0,2022-03-30 01:19:41,This horrid Honda Civic is the Lamborghini Aventador we have at home:  https://t.co/MjkttSozMc,en,[],[],https://twitter.com/thedrive/status/1508856433235873797,['https://www.thedrive.com/news/44958/this-horrid-honda-civic-is-the-lamborghini-aventador-we-have-at-home'],[],0,,5,2,0
317,1508848114169438218,gabbariele,1648572398000.0,2022-03-30 00:46:38,"Fabrizio Gavelli, General Manager of #Danone in #Italy and #Greece on the #book Essentials of Modern #Marketing:  https://t.co/AtO916mrNH #VCP #bebrilliant #anewpathtodigital #EOMM #caterpillarbrands #books #tiktok #Lamborghini #Knauf #Clementoni #Safilo #Bauli",en,"['danone', 'italy', 'greece', 'book', 'marketing', 'vcp', 'bebrilliant', 'anewpathtodigital', 'eomm', 'caterpillarbrands', 'books', 'tiktok', 'lamborghini', 'knauf', 'clementoni', 'safilo', 'bauli']",[],https://twitter.com/gabbariele/status/1508848114169438218,['https://www.tiktok.com/@gabbariele_official/video/7063189553649306885?is_copy_url=1&is_from_webapp=v1'],[],0,,1,1,0
321,1508824471452463110,YoungMoneySite,1648566761000.0,2022-03-29 23:12:41,"This week, Rari. Next week, Lambo 💨 #WeGoUp  https://t.co/Fa1JroixcO",en,['wegoup'],[],https://twitter.com/YoungMoneySite/status/1508824471452463110,[],['https://pbs.twimg.com/media/FPBr2_6XsAMf4kb.jpg'],1,https://pbs.twimg.com/media/FPBr2_6XsAMf4kb.jpg,947,12,104
322,1508822946147540997,ashwsbreal,1648566397000.0,2022-03-29 23:06:37,3 cars I love   Tesla model S  Rolls Royce  Lamborghini   How about you ?,en,[],[],https://twitter.com/ashwsbreal/status/1508822946147540997,[],[],0,,373,190,95
327,1508806928465637387,gabbariele,1648562578000.0,2022-03-29 22:02:58,"""This book presents an up-to-date and insightful account of the working of modern marketing in today's troubled time."" #PhilpKotler. Discover the #book:  https://t.co/UjfEezjpAt with cases of #Danone #Lamborghini #marketing #iliad #Knauf #EOMM #bebrilliant #purpose #sustainability  https://t.co/3RddjM1pRU",en,"['philpkotler', 'book', 'danone', 'lamborghini', 'marketing', 'iliad', 'knauf', 'eomm', 'bebrilliant', 'purpose', 'sustainability']",[],https://twitter.com/gabbariele/status/1508806928465637387,['https://eomm.bebrilliant.it/'],['https://pbs.twimg.com/media/FPBb59AXIAweNs5.jpg'],1,https://pbs.twimg.com/media/FPBb59AXIAweNs5.jpg,0,0,0
328,1508806730108526595,USNewsCars,1648562531000.0,2022-03-29 22:02:11,"Given its extremely high performance and low production numbers, the Lamborghini Diablo is quickly becoming a highly desirable collectible car.  https://t.co/1rb4Y8IKLd",en,[],[],https://twitter.com/USNewsCars/status/1508806730108526595,['https://nytv.to/vR8Bp'],[],0,,1,0,0
330,1508803008326520840,1Xtra,1648561644000.0,2022-03-29 21:47:24,"""You might see me in a Lambo"" 🔥   @LethalBizzle went hard for this Live Lounge 💥  Catch today's replays on @BBCSounds  https://t.co/dAIVH8o7bP",en,[],[],https://twitter.com/1Xtra/status/1508803008326520840,[],[],1,https://pbs.twimg.com/ext_tw_video_thumb/1508802925765746693/pu/img/GNjMDHOgiYlMP5cR.jpg,20,2,3
331,1508794501934034944,MKBHD,1648559615000.0,2022-03-29 21:13:35,This morning I’m 99% sure I saw Dennis Rodman driving a convertible red Lamborghini on my way to the studio… It’s 29 degrees. What a legend.,en,[],[],https://twitter.com/MKBHD/status/1508794501934034944,[],[],0,,20097,290,360
332,1508792366626447361,RobbReport,1648559106000.0,2022-03-29 21:05:06,"Tecnomar's Lamborghini 63 has the Raging Bull's DNA, from the Aventador steering wheel to leather racing seats. And it's very, very fast.  https://t.co/Fef8CI1xsx",en,[],[],https://twitter.com/RobbReport/status/1508792366626447361,['https://robbreport.com/motors/marine/new-63-foot-lamborghini-yacht-supercar-1234624181/'],[],0,,2,0,0
334,1508789035279519744,Lamborghini,1648558312000.0,2022-03-29 20:51:52,"Personalization, what a passion! Our Ad Personam Program is here to make your dreams completely viable. How? By adapting every single aspect of our stunning Huracán STO.  #Lamborghini #AdPersonam  CO2 Emission and Fuel consumption Combined:  https://t.co/zr6fo0ia3H",en,"['lamborghini', 'adpersonam']",[],https://twitter.com/Lamborghini/status/1508789035279519744,['https://lam.bo/CE_Tw'],[],0,,439,10,46
335,1508788085244497920,asphalt,1648558086000.0,2022-03-29 20:48:06,Hey Racers! 🔥 Today's #Asphalt8 creator spotlight is dedicated to: Asphalt 89 😎 Check out this cool video where he tests Lamborghini Sián FKP 37 in Multiplayer and make sure to subscribe to his channel 👉  https://t.co/3GMIAmAiB7  https://t.co/yp3P9fynNy,en,['asphalt8'],[],https://twitter.com/asphalt/status/1508788085244497920,['https://youtu.be/fxmbb4R0ygM'],['https://pbs.twimg.com/media/FPBKqyiXIAQXHZJ.jpg'],1,https://pbs.twimg.com/media/FPBKqyiXIAQXHZJ.jpg,62,3,1
337,1508786489932623883,csmithSEC,1648557705000.0,2022-03-29 20:41:45,@intrepid_p @CryptoPunk4052 @erubes1 There's got to be a place in Orlando that would rent me a Lambo for a few hours 😂,en,[],[],https://twitter.com/csmithSEC/status/1508786489932623883,[],[],0,,1,0,0
338,1508785593605627912,csmithSEC,1648557492000.0,2022-03-29 20:38:12,@intrepid_p @CryptoPunk4052 @erubes1 If I wanted to go viral I could totally rent a lambo for a day and set this up. Would be good content,en,[],[],https://twitter.com/csmithSEC/status/1508785593605627912,[],[],0,,0,1,0
340,1508761206001401857,Eunicedwong,1648551677000.0,2022-03-29 19:01:17,So crypto bros upgraded from Lambo to Bugatti.   #BinanceBlockchainWeek  #binance  https://t.co/ocgfvJGl5b,en,"['binanceblockchainweek', 'binance']",[],https://twitter.com/Eunicedwong/status/1508761206001401857,[],['https://pbs.twimg.com/media/FPAyTlWakAc-tOj.jpg'],1,https://pbs.twimg.com/media/FPAyTlWakAc-tOj.jpg,289,35,7
341,1508756138195628041,LEGO_Group,1648550469000.0,2022-03-29 18:41:09,"@mortalgroove It's got to be Lambo worthy, right? 😎",en,[],[],https://twitter.com/LEGO_Group/status/1508756138195628041,[],[],0,,14,1,0
342,1508750846456172550,HYPEBEAST,1648549207000.0,2022-03-29 18:20:07,Platinum Motorsport's Widebody Lamborghini Urus Is Slammed and Thunderously Loud  https://t.co/6MFMX4ZCjb,en,[],[],https://twitter.com/HYPEBEAST/status/1508750846456172550,['https://hypebeast.com/2022/3/platinum-motorsport-lamborghini-urus-suv-tuned-slammed-24-inch-rims-1016-industries-widebody?utm_term=Autofeed&utm_campaign=twitter_post&utm_medium=social&utm_source=Twitter#Echobox=1648548206'],[],0,,56,0,5
343,1508744829744087040,news18dotcom,1648547773000.0,2022-03-29 17:56:13,"Lamborghini India achieves the milestone of delivering 400 Lamborghini across India since its full business operation in 2007, complementing the 86% growth recorded in India last year.   https://t.co/nVbkkZDU5F",en,[],[],https://twitter.com/news18dotcom/status/1508744829744087040,['https://www.news18.com/news/auto/lamborghini-crosses-400-sales-benchmark-in-india-reports-best-results-in-fy2022-4920128.html'],[],0,,1,0,0
344,1508743815653658626,Lamborghini,1648547531000.0,2022-03-29 17:52:11,It was the first time we drove our Essenza SCV12 at the Portimão circuit. It was a great honor and an absolutely great time.  We will be back here for the Lamborghini Grand Final.  #Lamborghini #LamborghiniSC #EssenzaSCV12  https://t.co/JGjga8jdf4,en,"['lamborghini', 'lamborghinisc', 'essenzascv12']",[],https://twitter.com/Lamborghini/status/1508743815653658626,[],['https://pbs.twimg.com/media/FPAfYW2XoAEqm8i.jpg'],1,https://pbs.twimg.com/media/FPAfYW2XoAEqm8i.jpg,1208,13,107
345,1508738144233213953,News18Auto,1648546179000.0,2022-03-29 17:29:39,"Lamborghini India achieves the milestone of delivering 400 Lamborghini across India since its full business operation in 2007, complementing the 86% growth recorded in India last year.  https://t.co/NhZDUBFPXj",en,[],[],https://twitter.com/News18Auto/status/1508738144233213953,['https://www.news18.com/news/auto/lamborghini-crosses-400-sales-benchmark-in-india-reports-best-results-in-fy2022-4920128.html'],[],0,,0,0,0
346,1508736842765684736,gabbariele,1648545868000.0,2022-03-29 17:24:28,Highlights of the launching event of Essentials of Modern #Marketing:  https://t.co/GSSRgXXkkw #visualcommunicationplanner #marketingcanvas #VCP #digitalstrategy #bebrilliant #anewpathtodigital #EOMM #caterpillarbrands #books #tiktok #Danone #Lamborghini #Knauf #Clementoni #hfarm,en,"['marketing', 'visualcommunicationplanner', 'marketingcanvas', 'vcp', 'digitalstrategy', 'bebrilliant', 'anewpathtodigital', 'eomm', 'caterpillarbrands', 'books', 'tiktok', 'danone', 'lamborghini', 'knauf', 'clementoni', 'hfarm']",[],https://twitter.com/gabbariele/status/1508736842765684736,['https://www.tiktok.com/@gabbariele_official/video/7061893180991622406?is_copy_url=1&is_from_webapp=v1'],[],0,,0,0,0
355,1508704258442641416,TopGearPh,1648538100000.0,2022-03-29 15:15:00,Pregnant woman gives husband a Lamborghini Huracan as advance gift #topgearph   https://t.co/aV8R6DmFev,en,['topgearph'],[],https://twitter.com/TopGearPh/status/1508704258442641416,['https://bit.ly/3qIf74v'],[],0,,1,1,0
357,1508702715282567177,HTAutotweets,1648537732000.0,2022-03-29 15:08:52,".@Lamborghini clocks 86% growth in India, sold 400 super luxury cars  #LamborghiniIndia achieves the milestone of delivering 400 Lamborghini across India since its full business operation in 2007.  Details:  https://t.co/ZHvKbmYehu  https://t.co/VX5MxWMMgH",en,['lamborghiniindia'],[],https://twitter.com/HTAutotweets/status/1508702715282567177,['https://bit.ly/3qG8nUM'],['https://pbs.twimg.com/media/FO_9CKRVkAMzJd0.jpg'],1,https://pbs.twimg.com/media/FO_9CKRVkAMzJd0.jpg,8,0,3
358,1508695074447757315,gabbariele,1648535910000.0,2022-03-29 14:38:30,Get a free sample of my new #book with #PhilipKotler - Denis Rothman and other gurus. We have defined the Essentials of Modern #Marketing with cases of #Danone #Lamborghini #Knauf #iliad #Bauli and many others.  https://t.co/UjfEezjpAt #bebrilliant #EOMM #purpose  https://t.co/nEs6KabS9q,en,"['book', 'philipkotler', 'marketing', 'danone', 'lamborghini', 'knauf', 'iliad', 'bauli', 'bebrilliant', 'eomm', 'purpose']",[],https://twitter.com/gabbariele/status/1508695074447757315,['https://eomm.bebrilliant.it/'],['https://pbs.twimg.com/media/FO_2LOoWQAAo5-1.png'],1,https://pbs.twimg.com/media/FO_2LOoWQAAo5-1.png,0,0,0
365,1508675209179504645,odmag,1648531174000.0,2022-03-29 13:19:34,"Last year, Lamborghini had hit the sales milestone of 300 super luxury cars in India. A third of those 300 cars sold were the Urus SUV. #Lamborghini #LamborghiniUrus   https://t.co/eogmFQldkP",en,"['lamborghini', 'lamborghiniurus']",[],https://twitter.com/odmag/status/1508675209179504645,['https://www.overdrive.in/news-cars-auto/lamborghini-india-complete-the-sale-of-400-cars-clocking-an-86-percent-growth-in-sales/'],[],0,,8,1,0
367,1508661491330822144,ExplosiveGyro,1648527903000.0,2022-03-29 12:25:03,@AyyJayyRL @SnoaFRL This the mf that said someone came on the lambo,en,[],[],https://twitter.com/ExplosiveGyro/status/1508661491330822144,[],[],0,,99,3,1
368,1508658959799898116,TopGearPh,1648527300000.0,2022-03-29 12:15:00,Pregnant woman gives husband a Lamborghini Huracan as advance gift #topgearph   https://t.co/aV8R6DEg63,en,['topgearph'],[],https://twitter.com/TopGearPh/status/1508658959799898116,['https://bit.ly/3qIf74v'],[],0,,1,0,0
369,1508634380465426433,rahulsood,1648521440000.0,2022-03-29 10:37:20,@brycent_ Variations of the Lambo Yellow mechabot hen.   🐔🐔🐔🤪  @mechafightclub #mechaholics  https://t.co/hSF5pbfD4E,en,['mechaholics'],[],https://twitter.com/rahulsood/status/1508634380465426433,[],"['https://pbs.twimg.com/media/FO---IgVIAYJAdS.jpg', 'https://pbs.twimg.com/media/FO---IhVkAMTAIq.jpg']",1,https://pbs.twimg.com/media/FO---IgVIAYJAdS.jpg,44,14,12
370,1508632536532062217,business_today,1648521000000.0,2022-03-29 10:30:00,#Lamborghini India had also curated its 3rd edition of Lamborghini Day in Goa to mark the milestone of selling 400 cars     https://t.co/6GMqmrL7mX,en,['lamborghini'],[],https://twitter.com/business_today/status/1508632536532062217,['https://www.businesstoday.in/auto/story/lamborghini-sells-400th-car-in-india-plans-new-trims-of-urus-huracan-in-2022-327576-2022-03-28'],[],0,,4,0,2
371,1508616242865012744,TopGearPh,1648517115000.0,2022-03-29 09:25:15,Pregnant woman gives husband a Lamborghini Huracan as advance gift #topgearph   https://t.co/aV8R6Dnd43,en,['topgearph'],[],https://twitter.com/TopGearPh/status/1508616242865012744,['https://bit.ly/3qIf74v'],[],0,,0,0,0
372,1508615268058157061,MikeBoard1200,1648516883000.0,2022-03-29 09:21:23,@BISAQR how many Lambo'ss did you get?,en,[],[],https://twitter.com/MikeBoard1200/status/1508615268058157061,[],[],0,,1,1,0
373,1508615144418410498,AviatorsLV,1648516853000.0,2022-03-29 09:20:53,This just in: Miss Lambo will be the bat dog of honor tomorrow 😍,en,[],[],https://twitter.com/AviatorsLV/status/1508615144418410498,[],[],0,,29,0,1
