,id,username,created_at,date,tweet,language,hashtags,cashtags,link,urls,photos,video,thumbnail,nlikes,nreplies,nretweets
324,1508518078547640327,VolvoTrucksUK,1648493711000.0,2022-03-29 02:55:11,"The Volvo FH is a long haul icon that optimises your uptime and fuel efficiency, and offers an outstanding driver environment. The latest Volvo FH is, simply put, better in every way. ⭐⭐⭐⭐⭐ Discover more:  https://t.co/KR61nrN3PI  #volvofh #volvotrucks  https://t.co/2AJHyxBmcq",en,"['volvofh', 'volvotrucks']",[],https://twitter.com/VolvoTrucksUK/status/1508518078547640327,['https://bit.ly/38oYZIX'],[],1,https://pbs.twimg.com/ext_tw_video_thumb/1508518035191128064/pu/img/SK5toIaSUo06zq8Z.jpg,35,1,3
328,1508484307874066437,TheDrum,1648485659000.0,2022-03-29 00:40:59,🚘@volvocars takes us on a #VR journey through the plug socket to promote its new electric car #C40 🚘🔌  #EV #Volvo #Electric #Cars #Marketing #Advertising  https://t.co/FrAXYqRv6b,en,"['vr', 'c40', 'ev', 'volvo', 'electric', 'cars', 'marketing', 'advertising']",[],https://twitter.com/TheDrum/status/1508484307874066437,['https://www.thedrum.com/news/2022/03/28/volvo-takes-us-consumers-journey-through-electric-sockets-ev-car-launch'],[],0,,0,0,0
330,1508466442903171076,HTAutotweets,1648481400000.0,2022-03-28 23:30:00,Take a look at this 1966 Volvo P1800 model. It isn't just decades old and still is gleaming fine - but has also run over 48 lakh kilometres!   This particular @volvocars model finds a place in @GWR. Read on.   https://t.co/n0EzVAsFkJ,en,[],[],https://twitter.com/HTAutotweets/status/1508466442903171076,['https://auto.hindustantimes.com/auto/news/terminator-of-cars-this-1966-volvo-has-been-driven-over-48-lakh-kilometres-41648445504793.html'],[],0,,1,0,0
331,1508463638394417154,VolvoCarUSA,1648480731000.0,2022-03-28 23:18:51,"@Jenuhpie Hi Jenna, we've sent you a message. Please check your inbox!",en,[],[],https://twitter.com/VolvoCarUSA/status/1508463638394417154,[],[],0,,0,0,0
333,1508459023821160456,nlcpeople,1648479631000.0,2022-03-28 23:00:31,Rhys Dingwall is celebrating a double success. He’s secured a permanent job with Volvo following a No Limits work placement and been voted ‘Young Person of the Year’ at an awards ceremony. Find out how our job coaches help young people into work.  https://t.co/z5RfngE1vR  https://t.co/V9CX9tVl9U,en,[],[],https://twitter.com/nlcpeople/status/1508459023821160456,['http://ow.ly/jaNR50ItPa7'],['https://pbs.twimg.com/media/FO8ffMnXsAEVP_p.jpg'],1,https://pbs.twimg.com/media/FO8ffMnXsAEVP_p.jpg,10,0,1
334,1508454603775516680,VolvoCarUSA,1648478577000.0,2022-03-28 22:42:57,"@JesusAv11134349 Hi Jesus, we've sent you a message. Please check your inbox!",en,[],[],https://twitter.com/VolvoCarUSA/status/1508454603775516680,[],[],0,,0,0,0
335,1508449913301991425,TheDrum,1648477459000.0,2022-03-28 22:24:19,Volvo takes US consumers on a journey through electric sockets for EV car launch  https://t.co/SR5zlRQrj1  https://t.co/oZLFR8SyfH,en,[],[],https://twitter.com/TheDrum/status/1508449913301991425,['http://dlvr.it/SMWNJB'],['https://pbs.twimg.com/media/FO8XM9gVkAIn9TT.jpg'],1,https://pbs.twimg.com/media/FO8XM9gVkAIn9TT.jpg,4,0,1
336,1508448059180605441,AllArtsTV,1648477017000.0,2022-03-28 22:16:57,"One artist, five sisters and a family’s love of cars in early 2000s-era Philadelphia anchors @don_jones’ immersive film “Volvo Truck and the Girls From Up the Hill.”   Watch it as part of the our #ArtistinResidence series April 10 at 8:30 p.m.  https://t.co/5GRSYCKCrm  https://t.co/1KJtFBm8VQ",en,['artistinresidence'],[],https://twitter.com/AllArtsTV/status/1508448059180605441,['https://bit.ly/3HwGF2m'],[],1,https://pbs.twimg.com/ext_tw_video_thumb/1508448009180307468/pu/img/sjgH9d1T-yTpIXpn.jpg,2,0,3
337,1508447929865949189,parthodasgupta,1648476986000.0,2022-03-28 22:16:26,Wireless charging by #Volvo - what a great innovation  https://t.co/K85V4iihkj,en,['volvo'],[],https://twitter.com/parthodasgupta/status/1508447929865949189,[],[],1,https://pbs.twimg.com/ext_tw_video_thumb/1508447862513754115/pu/img/g1qs4s_yS2A7o0vF.jpg,10,0,3
338,1508438806231498756,CarsSouthAfrica,1648474811000.0,2022-03-28 21:40:11,Volvo SA is moving swiftly toward its planned all-electric future by integrating greener technology into its diverse product portfolio.  ⚡ Contributor @IanMcLaren76 looks at the options available to our increasingly efficiency-conscious market.  https://t.co/gHGIq3Tjpj  https://t.co/wzDMikNC4F,en,[],[],https://twitter.com/CarsSouthAfrica/status/1508438806231498756,['https://bit.ly/VolvoSAelec22'],"['https://pbs.twimg.com/media/FO8NFBNWQAM5eET.jpg', 'https://pbs.twimg.com/media/FO8NFBMXoAc_yjM.jpg']",1,https://pbs.twimg.com/media/FO8NFBNWQAM5eET.jpg,7,1,2
341,1508432453110833158,VolvoCarUSA,1648473296000.0,2022-03-28 21:14:56,"@kevingame84 Hi Kevin, we've sent you a message. Please check your inbox.",en,[],[],https://twitter.com/VolvoCarUSA/status/1508432453110833158,[],[],0,,0,0,0
342,1508429203217305606,VolvoTrucksUK,1648472521000.0,2022-03-28 21:02:01,"🇵🇪 We focus primarily on Volvos from the UK and Ireland, but every so often pictures arrive in our inbox from around the world... including this shot of a Volvo FH from Melvin Rodriguez, of transport company Mi Jasmin SRL, based in Peru. 👍  https://t.co/lQs53Jsos2",en,[],[],https://twitter.com/VolvoTrucksUK/status/1508429203217305606,[],['https://pbs.twimg.com/media/FO8EXW8WQAAz6A8.jpg'],1,https://pbs.twimg.com/media/FO8EXW8WQAAz6A8.jpg,67,1,6
344,1508396270246842368,VolvoCarUK,1648464670000.0,2022-03-28 18:51:10,"@rachski5 Hi Rachel, thank you for reaching out. May we ask that you directly message us your Reg and we can look into this further for you.",en,[],[],https://twitter.com/VolvoCarUK/status/1508396270246842368,[],[],0,,0,0,0
349,1508372373669650434,VolvoTrucksUK,1648458972000.0,2022-03-28 17:16:12,"Check out our flagship, the latest generation Volvo FH16 – with uncompromising comfort and loaded with features that make you more efficient.  See what an FH16 could do for your fleet:  https://t.co/noiq6AfAI7  #volvotrucks #volvofh16  https://t.co/KeTcnFFUkm",en,"['volvotrucks', 'volvofh16']",[],https://twitter.com/VolvoTrucksUK/status/1508372373669650434,['https://bit.ly/2QondNy'],[],1,https://pbs.twimg.com/ext_tw_video_thumb/1508372324210429952/pu/img/r40ytMtwEDHZhYSs.jpg,48,0,5
354,1508350549879668744,CarDealerEd,1648453769000.0,2022-03-28 15:49:29,"Inchcape acquires Porsche, Land Rover and Volvo distribution business  https://t.co/WQDJLIo9U1",en,[],[],https://twitter.com/CarDealerEd/status/1508350549879668744,['https://cardealermagazine.co.uk/publish/inchcape-acquires-porsche-land-rover-and-volvo-distribution-business/258602'],[],0,,1,0,0
355,1508342958671958017,HTAutotweets,1648451959000.0,2022-03-28 15:19:19,Take a look at this 1966 Volvo P1800 model. It isn't just decades old and still is gleaming fine - but has also run over 48 lakh kilometres!   This particular @volvocars model finds a place in @GWR. Read on.   https://t.co/n0EzVAtdah,en,[],[],https://twitter.com/HTAutotweets/status/1508342958671958017,['https://auto.hindustantimes.com/auto/news/terminator-of-cars-this-1966-volvo-has-been-driven-over-48-lakh-kilometres-41648445504793.html'],[],0,,3,0,2
357,1508335754749136896,volvocars,1648450242000.0,2022-03-28 14:50:42,"@Dolpff Hello, each market has the mandate to assess which models should be offered in their country, based on previous sales and demand. We are, unfortunately, not able to influence this.",en,[],[],https://twitter.com/volvocars/status/1508335754749136896,[],[],0,,0,1,0
358,1508333147414577158,volvocars,1648449620000.0,2022-03-28 14:40:20,"@CanadaVolvos Hello, we have sent you a message, please check your inbox.",en,[],[],https://twitter.com/volvocars/status/1508333147414577158,[],[],0,,0,0,0
363,1508232668042911747,clevelanddotcom,1648425664000.0,2022-03-28 08:01:04,"A 36-year-old man – identified as Marshall Taylor, of Elyria – was driving northbound in his Volvo sedan when he went off the road and struck a utility pole, which caused the car to overturn, authorities said. Taylor was ejected from the car in the crash.  https://t.co/NeY6E4k4lY",en,[],[],https://twitter.com/clevelanddotcom/status/1508232668042911747,['https://trib.al/z3pWv2p'],[],0,,3,1,1
366,1508170784577327104,HindustanTimes,1648410910000.0,2022-03-28 03:55:10,"Now, travel from Chandigarh airport to Shimla, Dharamshala, Manali on a Volvo  https://t.co/TTUCJYLoNk",en,[],[],https://twitter.com/HindustanTimes/status/1508170784577327104,['https://www.hindustantimes.com/cities/chandigarh-news/now-travel-from-chandigarh-airport-to-shimla-dharamshala-manali-on-a-volvo-101648410900356.html'],[],0,,1,1,0
367,1508151622681219078,VolvoTrucksUK,1648406341000.0,2022-03-28 02:39:01,"Ending the week with this stunning sunset photo🌅    📸Credits to driver Luke Williams🙌⬇️   For the chance of being featured, DM or tag us in your photos!💙   #VolvoTrucks #VolvoTrucksmoments #VolvoTrucker #Trucker #Truckspotting #Truckphotography #Truck #Trucks #Truckdriver  https://t.co/Pz9q9l6kVY",en,"['volvotrucks', 'volvotrucksmoments', 'volvotrucker', 'trucker', 'truckspotting', 'truckphotography', 'truck', 'trucks', 'truckdriver']",[],https://twitter.com/VolvoTrucksUK/status/1508151622681219078,[],['https://pbs.twimg.com/media/FO4H6BGXwAYf2Ij.jpg'],1,https://pbs.twimg.com/media/FO4H6BGXwAYf2Ij.jpg,35,0,2
368,1508146283286081546,VolvoCarUK,1648405068000.0,2022-03-28 02:17:48,"@rifle36 We are sorry to hear of your most recent experience. Please could you DM us further information, we can get this looked into for you. Best Regards, Volvo Cars",en,[],[],https://twitter.com/VolvoCarUK/status/1508146283286081546,[],[],0,,0,0,0
369,1508133245795241985,vagina_museum,1648401960000.0,2022-03-28 01:26:00,"FANNY FACT: ""vulva"" and ""Volvo"" actually *do* have the same roots as well as sounding similar in a way which can be very funny.   Both are rooted in the Latin word ""volvere"".",en,[],[],https://twitter.com/vagina_museum/status/1508133245795241985,[],[],0,,252,6,36
372,1508096252088569859,therealautoblog,1648393140000.0,2022-03-27 22:59:00,"2022 Volvo C40 Recharge First Drive Review | All electric, all Swedish:  https://t.co/6yOiWcXwaW  https://t.co/0CFSy3AJc3",en,[],[],https://twitter.com/therealautoblog/status/1508096252088569859,['https://bit.ly/3ioBCqv'],"['https://pbs.twimg.com/media/FOehap0X0AM2V-c.jpg', 'https://pbs.twimg.com/media/FOehaq2WUAIJdSP.jpg', 'https://pbs.twimg.com/media/FOeharvXMAA0yfp.jpg', 'https://pbs.twimg.com/media/FOehaseXsAUGPg-.jpg']",1,https://pbs.twimg.com/media/FOehap0X0AM2V-c.jpg,57,1,6
377,1508073940568219650,roadshow,1648387820000.0,2022-03-27 21:30:20,Håkan Samuelsson: Exit interview with the CEO who rebooted Volvo  https://t.co/Xv92BuIoUe,en,[],[],https://twitter.com/roadshow/status/1508073940568219650,['https://trib.al/mziy10t'],[],0,,2,0,0
381,1507953082457640965,volvocarsin,1648359005000.0,2022-03-27 13:30:05,The new Volvo XC90 petrol with mild hybrid technology comes equipped with advanced safety features to protect you and your passengers at all times.  Find out more :  https://t.co/zY9eNMvzwl  #VolvoIndia #XC90  https://t.co/MNXwym7j9t,en,"['volvoindia', 'xc90']",[],https://twitter.com/volvocarsin/status/1507953082457640965,['https://bit.ly/3uDtckW'],['https://pbs.twimg.com/media/FO1TVezWYAILc_R.jpg'],1,https://pbs.twimg.com/media/FO1TVezWYAILc_R.jpg,2962,33,238
382,1507941640350011393,Ohthatflo,1648356277000.0,2022-03-27 12:44:37,"@tuanies I tried really hard to get a picture but i saw a Volvo today with a license plate frame that said ""caution: swedish driver""",en,[],[],https://twitter.com/Ohthatflo/status/1507941640350011393,[],[],0,,1,0,0
385,1507892912226545669,therealautoblog,1648344660000.0,2022-03-27 09:31:00,Volvo LX03 construction concept inspired by LEGO becomes reality.  https://t.co/neKXfj1Tkr,en,[],[],https://twitter.com/therealautoblog/status/1507892912226545669,[],[],1,https://pbs.twimg.com/media/FDRyFnbWYAYMwA0.jpg,59,3,10
388,1507877356437794817,KOINNews,1648340951000.0,2022-03-27 08:29:11,"Workers at Starbucks, Volvo hold pro-union rallies   https://t.co/sObtGaZlM0  https://t.co/5xIF2mrTQ9",en,[],[],https://twitter.com/KOINNews/status/1507877356437794817,['https://www.koin.com/local/multnomah-county/workers-at-starbucks-volvo-hold-pro-union-rallies/'],['https://pbs.twimg.com/media/FO0Ob-2VQAQ0BOW.jpg'],1,https://pbs.twimg.com/media/FO0Ob-2VQAQ0BOW.jpg,5,0,1
390,1507869800273432581,RealTomPetrini,1648339149000.0,2022-03-27 07:59:09,"Just saw a slab meetup and wondered aloud, “what’s the dumbest car you could do that to” and at that moment I got cut off by a dude in a 90’s Volvo station wagon with em",en,[],[],https://twitter.com/RealTomPetrini/status/1507869800273432581,[],[],0,,6,1,1
393,1507840105557467141,ColinTurkington,1648332070000.0,2022-03-27 06:01:10,@Trevor6080 @SilverstoneUK @OfficialBARCHQ The Volvo!! My car only wanted to do 12 of the 13 laps 😭  https://t.co/B4DPMJIdwv,en,[],[],https://twitter.com/ColinTurkington/status/1507840105557467141,[],['https://pbs.twimg.com/media/FOzslVNWQAANgKv.jpg'],1,https://pbs.twimg.com/media/FOzslVNWQAANgKv.jpg,0,0,0
394,1507823978563391495,gregallenRTE,1648328225000.0,2022-03-27 04:57:05,"@edebaroid McGinley won the 2005 Volvo Masters at Valderrama, the European Tour Championship. One of the deepest leaderboards in the C’ship history. Won by 2 from Sergio Garcia.Tied 3rd was Monty, Donald and Olazabal, Westwood back in 7th. McGinley covered the last 53 holes without a bogey.",en,[],[],https://twitter.com/gregallenRTE/status/1507823978563391495,[],[],0,,0,1,0
395,1507806326684291073,IXCairport,1648324016000.0,2022-03-27 03:46:56,"Fare and scheduled timings of #HRTC Volvo bus from @IXCairport to Shimla, Manali &amp; Dharamshala is shown below:  https://t.co/eaMQQRjN8P",en,['hrtc'],[],https://twitter.com/IXCairport/status/1507806326684291073,[],['https://pbs.twimg.com/media/FOzN3LUaIAALxIB.jpg'],1,https://pbs.twimg.com/media/FOzN3LUaIAALxIB.jpg,3,1,0
396,1507786264006832143,JeremyClarkson,1648319233000.0,2022-03-27 02:27:13,"Volvo, it seems, has much to learn from Haas.",en,[],[],https://twitter.com/JeremyClarkson/status/1507786264006832143,[],[],0,,18154,211,602
397,1507764472810811396,stratorob,1648314037000.0,2022-03-27 01:00:37,"Volvo's parent company establishes #blockchain joint venture headquarters in Wuxi, #China  https://t.co/NacQTKKi1K @Cointelegraph via @stratorob  @volvocars @dinisguarda @Stevewal63 @UrsBolt @efipm @AkwyZ @justinsuntron #Technology #BlockchainTechnology #Business #News #Innovation",en,"['blockchain', 'china', 'technology', 'blockchaintechnology', 'business', 'news', 'innovation']",[],https://twitter.com/stratorob/status/1507764472810811396,['https://cointelegraph.com/news/volvo-s-parent-company-establishes-blockchain-joint-venture-headquarters-in-wuxi-china'],[],0,,1,1,3
401,1507749355998089221,VolvoTrucksUK,1648310433000.0,2022-03-27 00:00:33,"Smart safety, improved ergonomics, maximum comfort. Is it time you explored our versatile Volvo FM?  Optimise your operations 👇  https://t.co/9ddICL9XB7  #volvofm #drivingprogress  https://t.co/DSDAZMa68n",en,"['volvofm', 'drivingprogress']",[],https://twitter.com/VolvoTrucksUK/status/1507749355998089221,['https://bit.ly/3wjg6vy'],[],1,https://pbs.twimg.com/ext_tw_video_thumb/1507749254684626953/pu/img/P_Wvrt7i41O2z_aF.jpg,8,0,1
403,1507735920526729223,VolvoCarUK,1648307230000.0,2022-03-26 23:07:10,"@StuartBrown__ Thank you for reaching out to us, please could you DM us your vehicle reg and postcode. We will be happy to reach out to the supplier for you. Kind Regards, Volvo Cars.",en,[],[],https://twitter.com/VolvoCarUK/status/1507735920526729223,[],[],0,,0,0,0
406,1507637181485142016,NotifyNYC,1648283689000.0,2022-03-26 16:34:49,"#MissingVulnerableAdult Harold S. Kaplan, M/W/85, driving a 2008 blue Volvo C-30 with NYS Plate: CU508K, from Irvington, NY. Seen? Call 9-1-1. Multilingual &amp; ASL Link:  https://t.co/YuJCWU4Yr9.  https://t.co/nsuXvw7wxJ",en,['missingvulnerableadult'],[],https://twitter.com/NotifyNYC/status/1507637181485142016,['http://on.nyc.gov/1UYt0TX'],['https://pbs.twimg.com/media/FOwziePWUAEe1CP.jpg'],1,https://pbs.twimg.com/media/FOwziePWUAEe1CP.jpg,6,0,9
408,1507598284336021504,VolvoCEGlobal,1648274415000.0,2022-03-26 14:00:15,"Each year, Volvo facilities across the world are turning off all lights during #EarthHour to symbolically show our commitment to drive change and willingness to fight climate change – every day. Switch off with us at 8.30 PM!  https://t.co/WCDg8DlAmd",en,['earthhour'],[],https://twitter.com/VolvoCEGlobal/status/1507598284336021504,[],[],1,https://pbs.twimg.com/ext_tw_video_thumb/1507596999713075201/pu/img/BOqScuVCltHKGgJ2.jpg,15,0,2
412,1507550862008549376,moneycontrolcom,1648263109000.0,2022-03-26 10:51:49,"#AutoWithMC: Volvo’s approach to suitably contemporising the XC90 has been to throw in a new 2.0-litre, four-cylinder petrol motor. So, the question is, can the new XC90 B6 justify its price tag? 🚗  Find out 👇  https://t.co/63luE2TLYC  @ParthCharan ✍️ | #VolvoXC90B6 #XC90 #Volvo",en,"['autowithmc', 'volvoxc90b6', 'xc90', 'volvo']",[],https://twitter.com/moneycontrolcom/status/1507550862008549376,['https://www.moneycontrol.com/news/automobile/2022-volvo-xc90-b6-a-gentleman-off-roader-that-exemplifies-scandinavian-minimalism-8276821.html'],[],0,,8,0,0
413,1507452283746979856,ThatChrisRyan,1648239606000.0,2022-03-26 04:20:06,@SimonRex But a Volvo? Is that a Rexmobile?,en,[],[],https://twitter.com/ThatChrisRyan/status/1507452283746979856,[],[],0,,0,0,0
414,1507448502636359682,Jalopnik,1648238704000.0,2022-03-26 04:05:04,"Plymouth Prowler, Volvo 1800S, Volkswagen 412 Wagon: The Dopest Cars I Found For Sale Online  https://t.co/AixaAHYing  https://t.co/rH9VXh52vt",en,[],[],https://twitter.com/Jalopnik/status/1507448502636359682,['http://dlvr.it/SMNHyt'],['https://pbs.twimg.com/media/FOuIbHgVkAENCKv.jpg'],1,https://pbs.twimg.com/media/FOuIbHgVkAENCKv.jpg,15,0,3
416,1507423127307010062,thesportsGab,1648232654000.0,2022-03-26 02:24:14,@Volvo_Roger Haha awesome!,en,[],[],https://twitter.com/thesportsGab/status/1507423127307010062,[],[],0,,1,0,0
417,1507419861777014785,thesportsGab,1648231876000.0,2022-03-26 02:11:16,@Volvo_Roger He’s comin!!!,en,[],[],https://twitter.com/thesportsGab/status/1507419861777014785,[],[],0,,1,1,0
418,1507408243936669707,SwedeninArmenia,1648229106000.0,2022-03-26 01:25:06,"Another two visits to 🇸🇪 company reps in 🇦🇲 this week included #Volvo Construction Equipment (FalconLLC) &amp; AssaAbloy (IteqLLC). Thanks to Aram,Edgar, Romina &amp; your teams for briefings &amp; good discussions! #Sweden #Armenia @assaabloygs @VolvoCEGlobal  https://t.co/APy3C5mPyt",en,"['volvo', 'sweden', 'armenia']",[],https://twitter.com/SwedeninArmenia/status/1507408243936669707,[],"['https://pbs.twimg.com/media/FOtjzcjWYAI2Vzg.jpg', 'https://pbs.twimg.com/media/FOtjzccXwAEFvnL.jpg']",1,https://pbs.twimg.com/media/FOtjzcjWYAI2Vzg.jpg,15,0,1
419,1507407762921299969,therealautoblog,1648228991000.0,2022-03-26 01:23:11,"This week's podcast covers driving the 1988 BMW M5, Volvo C40 Recharge and the reveal of the Maserati Grecale.  https://t.co/w0e1t7fw2y  https://t.co/imzygupmDj",en,[],[],https://twitter.com/therealautoblog/status/1507407762921299969,['https://bit.ly/3NoBPIi'],['https://pbs.twimg.com/media/FOtjXkvXoAEDfNe.jpg'],1,https://pbs.twimg.com/media/FOtjXkvXoAEDfNe.jpg,6,0,0
421,1507396075400822785,ChristinMP_TOI,1648226205000.0,2022-03-26 00:36:45,@Dhruvnk22 @TheKannadiga_RF @BMTC_BENGALURU @SuryaSen True. BMTC Majestic Volvo depot manager took an initiative to paste those fare reduction stickers.,en,[],[],https://twitter.com/ChristinMP_TOI/status/1507396075400822785,[],[],0,,2,1,0
422,1507390712920395776,thesportsGab,1648224926000.0,2022-03-26 00:15:26,@Volvo_Roger I swear he knows when the camera is rolling 😂😂,en,[],[],https://twitter.com/thesportsGab/status/1507390712920395776,[],[],0,,2,2,0
423,1507379908951085056,roadshow,1648222350000.0,2022-03-25 23:32:30,"In an exclusive interview, the former Volvo CEO looks back on his decade-long tenure with the Swedish automaker  https://t.co/gZRAUfclx8",en,[],[],https://twitter.com/roadshow/status/1507379908951085056,['https://trib.al/IQSTLQK'],[],0,,2,0,0
424,1507371977178497028,CPAutoScribe,1648220459000.0,2022-03-25 23:00:59,"I'm not sure there's been a more transformative CEO for a legacy automaker over the last 25 years than @Volvo's @hakan_samuel. Our @Tim_Stevens sat down with Hakan (okay, he teleconferenced) for this excellent and wide-ranging exclusive exit interview:   https://t.co/gfkjWQogbx",en,[],[],https://twitter.com/CPAutoScribe/status/1507371977178497028,['https://www.cnet.com/roadshow/news/hakan-samuelsson-exit-interview-volvo-ceo/'],[],0,,6,0,2
429,1507345760655917060,richontech,1648214209000.0,2022-03-25 21:16:49,"My latest for @KTLAMorningNews: I take a test drive in Volvo's first all-electric SUV, the C40 Recharge  https://t.co/g2J7Py9lIG",en,[],[],https://twitter.com/richontech/status/1507345760655917060,['https://ktla.com/morning-news/technology/volvo-first-all-electric-suv-c40-recharge-test-drive-palm-springs-richontech/'],[],0,,23,5,3
431,1507341623461662735,PistonHeads,1648213222000.0,2022-03-25 21:00:22,"A Volvo XC70 with 211,000 miles. High miles, low price - big bargain?   https://t.co/t9kMlkHCsd",en,[],[],https://twitter.com/PistonHeads/status/1507341623461662735,['https://www.pistonheads.com/news/ph-features-sheds/volvo-xc70-shed-of-the-week/45480'],[],0,,6,3,0
433,1507333994551066624,VolvoTrucksUK,1648211403000.0,2022-03-25 20:30:03,"Great to hear from @Manfreightltd driver Paul Totten whose Volvo FH is still going strong with more than 1.3 million km on the clock💪    Paul comments: ""The FH has nice comfort all round, with the controls all at hand and easy to reach.""  Brilliant picture Paul!🧡  https://t.co/eNzaDCfHlt",en,[],[],https://twitter.com/VolvoTrucksUK/status/1507333994551066624,[],['https://pbs.twimg.com/media/FOsgRpHX0AwFRp9.jpg'],1,https://pbs.twimg.com/media/FOsgRpHX0AwFRp9.jpg,47,1,6
435,1507306899414437889,volvocars,1648204943000.0,2022-03-25 18:42:23,"@David_vs_Volvo Hi David, we have sent you a message. We'd be happy to assist you further once we receive your contact details.",en,[],[],https://twitter.com/volvocars/status/1507306899414437889,[],[],0,,0,1,0
438,1507283035787608072,Kleyntrucks,1648199254000.0,2022-03-25 17:07:34,"Used Tractor unit VOLVO FH 500 (2020) 311,756 km for sale!  https://t.co/5ounpmwy5s via @KleynTrucks #trucks #transport",en,"['trucks', 'transport']",[],https://twitter.com/Kleyntrucks/status/1507283035787608072,['https://www.kleyntrucks.com/truck/detail/290229?nomobile&utm_campaign=NIS&utm_source=twitter_KleynTrucks&utm_medium=social&utm_content=stock'],[],0,,0,0,0
439,1507281170748391477,Kleyntrucks,1648198809000.0,2022-03-25 17:00:09,"Used Tractor unit VOLVO FH 500 (2020) 359,639 km for sale!  https://t.co/Kqh0HiIP7X via @KleynTrucks #trucks #transport",en,"['trucks', 'transport']",[],https://twitter.com/Kleyntrucks/status/1507281170748391477,['https://www.kleyntrucks.com/truck/detail/290226?nomobile&utm_campaign=NIS&utm_source=twitter_KleynTrucks&utm_medium=social&utm_content=stock'],[],0,,1,0,0
441,1507272599897665537,AngellicAribam,1648196766000.0,2022-03-25 16:26:06,"Was an honor to join the graduation ceremony of Swedish Chamber’s #GenderTaskForce —comprising industry leaders (IKEA, Volvo, Tetra Pak etc). My advice to the cohort — question patriarchy, continuously unlearn &amp; learn. Thanks @SwedeninIndia for making me a part of their day!  https://t.co/LaJJXa3zeV",en,['gendertaskforce'],[],https://twitter.com/AngellicAribam/status/1507272599897665537,[],['https://pbs.twimg.com/media/FOrocC-VEAADraW.jpg'],1,https://pbs.twimg.com/media/FOrocC-VEAADraW.jpg,10,0,2
442,1507265446575325184,ETIndustryNews,1648195060000.0,2022-03-25 15:57:40,Eicher-Volvo JV may plan to float new unit for EVs #ETIndustryNews  https://t.co/eKYqu7OPJH,en,['etindustrynews'],[],https://twitter.com/ETIndustryNews/status/1507265446575325184,['https://ift.tt/Ju40q1y'],[],0,,0,0,0
445,1507251341579669518,DavidPapp,1648191697000.0,2022-03-25 15:01:37,"Volvo C40 Recharge is the EV version of that boxy, family-friendly Volvo we all know and love  https://t.co/2HPx1Z5Nda  https://t.co/tYrfnK97WU",en,[],[],https://twitter.com/DavidPapp/status/1507251341579669518,['https://ift.tt/52eIvXc'],['https://pbs.twimg.com/media/FOrVG5vXEAIFtQx.jpg'],1,https://pbs.twimg.com/media/FOrVG5vXEAIFtQx.jpg,0,0,0
446,1507241831947374594,AmbLindnerIndia,1648189430000.0,2022-03-25 14:23:50,"Since own truck driver times (here transferring Mercedes trucks fr Munich to Baghdad 1976), have special sympathy &amp; compassion with all those working on giant’s steering wheels. Like today at Tapin North coal mine, proud driver of truck 9 (a Volvo) 17 years on job, zero accidents  https://t.co/fkkSW1yE3h",en,[],[],https://twitter.com/AmbLindnerIndia/status/1507241831947374594,[],"['https://pbs.twimg.com/media/FOrMcKEagAE_Uq8.jpg', 'https://pbs.twimg.com/media/FOrMcKEaQAA3yMZ.jpg', 'https://pbs.twimg.com/media/FOrMcKHagAAFBHG.jpg', 'https://pbs.twimg.com/media/FOrMcKDaMAEq4HK.jpg']",1,https://pbs.twimg.com/media/FOrMcKEagAE_Uq8.jpg,325,14,23
447,1507237781973925893,volvocarsin,1648188465000.0,2022-03-25 14:07:45,"@Rachit_Indi @volvocars We're sorry for the inconvenience caused, Rachit. Please DM us your contact information and Team Volvo will reach out to you soon.  Thank you for your patience.",en,[],[],https://twitter.com/volvocarsin/status/1507237781973925893,[],[],0,,1,1,0
