,id,username,created_at,date,tweet,language,hashtags,cashtags,link,urls,photos,video,thumbnail,nlikes,nreplies,nretweets
223,1509155068578304011,VolvoTrucksUK,1648645581000.0,2022-03-30 21:06:21,The Volvo FH16 offers power to work efficiently and a level of comfort that makes it all less of a strain. It’s the perfect match for the heaviest assignments.  Pick your fleet flagship right here:  https://t.co/noiq6AfAI7  #volvofh16 #fh16 #volvoflagship  https://t.co/Zrjs1JMoEW,en,"['volvofh16', 'fh16', 'volvoflagship']",[],https://twitter.com/VolvoTrucksUK/status/1509155068578304011,['https://bit.ly/2QondNy'],[],1,https://pbs.twimg.com/ext_tw_video_thumb/1509154988441931779/pu/img/IzmfJOgDqDTfYwks.jpg,18,1,3
224,1509148717227540492,Automotive_News,1648644067000.0,2022-03-30 20:41:07,"Mercedes readies new GLC to battle BMW, Audi, Volvo premium midsize crossovers  https://t.co/j1SSFMW28c  https://t.co/ZufWUgfV3F",en,[],[],https://twitter.com/Automotive_News/status/1509148717227540492,['http://dlvr.it/SMf1JY'],['https://pbs.twimg.com/media/FPGSwt2VkAEb0q0.jpg'],1,https://pbs.twimg.com/media/FPGSwt2VkAEb0q0.jpg,5,0,0
225,1509146626698399744,dzuidijk,1648643569000.0,2022-03-30 20:32:49,“All the stuff that you can do in your smartphone will be almost inherently native within the vehicle.”  -#Volvo's new CEO Jim Rowan on his plans for the storied car company    https://t.co/k6e9NfWGf9 via @crtrud,en,['volvo'],[],https://twitter.com/dzuidijk/status/1509146626698399744,['https://www.bloomberg.com/news/articles/2022-03-30/volvo-brings-in-blackberry-veteran-to-turn-its-cars-into-iphones-on-wheels'],[],0,,1,1,1
226,1509141648562921473,business,1648642382000.0,2022-03-30 20:13:02,"Volvo Car's new CEO saw Apple and Google's upheaval of the phone industry from up close, and sees similar transformation coming to cars  https://t.co/0h5HzgKs44",en,[],[],https://twitter.com/business/status/1509141648562921473,['https://trib.al/rCIuNGE'],[],0,,20,3,7
227,1509140848084148225,business,1648642191000.0,2022-03-30 20:09:51,"Volvo Car's new CEO saw Apple and Google's upheaval of the phone industry from up close, and sees similar transformation coming to cars  https://t.co/lZm7lWp46m",en,[],[],https://twitter.com/business/status/1509140848084148225,['https://trib.al/xqI1isO'],[],0,,31,6,13
228,1509130175597924353,VolvoGroup,1648639646000.0,2022-03-30 19:27:26,"Watch Volvo Group’s recent panel discussion on the global energy transition journey, with @ETC_energy and leaders from across the energy landscape at companies like @VattenfallGroup, @SSAB_AB, and @Energi_mynd:  https://t.co/C3gx2aldrT  #energytransition @wedonthavetime",en,['energytransition'],[],https://twitter.com/VolvoGroup/status/1509130175597924353,['https://youtu.be/9bgTOT90yqo'],[],0,,14,1,6
229,1509129829085429766,AutoNewsEurope,1648639564000.0,2022-03-30 19:26:04,"Mercedes readies new GLC to battle BMW, Audi, Volvo premium midsize SUVs  https://t.co/HJel1aeReK  https://t.co/dkNGgzkad0",en,[],[],https://twitter.com/AutoNewsEurope/status/1509129829085429766,['http://dlvr.it/SMdmdZ'],['https://pbs.twimg.com/media/FPGBlRrUcAIFMl7.jpg'],1,https://pbs.twimg.com/media/FPGBlRrUcAIFMl7.jpg,1,0,0
237,1509107404272766985,VolvoGroup,1648634217000.0,2022-03-30 17:56:57,"We are proud to congratulate @VolvoTrucks on a record-breaking order for 110 electric trucks. The order from @Maersk company, Performance Team, is great progress in the shift to electrification and decarbonization of global transport.   https://t.co/PRWN5c577Q  #electricvehicles",en,['electricvehicles'],[],https://twitter.com/VolvoGroup/status/1509107404272766985,['https://www.volvotrucks.com/en-en/news-stories/press-releases/2022/mar/volvo-trucks-receives-record-order-for-electric-trucks-from-maersk.html?sc_cid=soco-BqpG2ZqA'],[],0,,16,0,2
241,1509094316685279236,VolvoCarUK,1648631097000.0,2022-03-30 17:04:57,"@curragh Hi Brian, We are sorry to hear this. Please could you DM us with further information so we can look into this for you?",en,[],[],https://twitter.com/VolvoCarUK/status/1509094316685279236,[],[],0,,0,0,0
245,1509081643272781827,BeauTFC,1648628075000.0,2022-03-30 16:14:35,@EliFuckinWatson I saw a Volvo station wagon with its roof cut out once.,en,[],[],https://twitter.com/BeauTFC/status/1509081643272781827,[],[],0,,62,4,0
246,1509080866534064128,volvocarsin,1648627890000.0,2022-03-30 16:11:30,"@kaul_aadhar @KamalBaliVolvo Thank you for sharing your contact information, Aadhar. It has been sent forward to the team.",en,[],[],https://twitter.com/volvocarsin/status/1509080866534064128,[],[],0,,0,0,0
247,1509080605530951684,volvocarsin,1648627828000.0,2022-03-30 16:10:28,"@SHARMABHANWAR3 Hi Bhanwar. Thank you for your interest in Volvo Car India. You may find all the information you need, including prices, right here:   https://t.co/02SqFlVRUu",en,[],[],https://twitter.com/volvocarsin/status/1509080605530951684,['https://bit.ly/3ml5WEU'],[],0,,0,0,0
248,1509080204681281539,volvocarsin,1648627732000.0,2022-03-30 16:08:52,"@MOHANLA24496007 Hi Mohan. Thank you for your interest in Volvo Car India. You may find all the details you need, including prices, right here:   https://t.co/02SqFlVRUu",en,[],[],https://twitter.com/volvocarsin/status/1509080204681281539,['https://bit.ly/3ml5WEU'],[],0,,0,0,0
249,1509078002545610753,VolvoTrucksUK,1648627207000.0,2022-03-30 16:00:07,"""There’s no doubt that Volvo Trucks supplies premium vehicles, but when it comes to upgrading our fleet, we don’t just focus on efficiency and high quality, we also look for a strong relationship with the local dealer."" - Mark Hope, Transport Services Contract Manager @ABAgriLtd  https://t.co/6sBdS1fEk5",en,[],[],https://twitter.com/VolvoTrucksUK/status/1509078002545610753,[],['https://pbs.twimg.com/media/FPFScR2XwAAPETK.jpg'],1,https://pbs.twimg.com/media/FPFScR2XwAAPETK.jpg,54,0,7
250,1509076723648057347,volvocarsin,1648626902000.0,2022-03-30 15:55:02,"@donzer7 @sidpatankar @volvocars @carandbike @carandbikehindi @ShamsNaqvi @ameya_naik @DigitallyBones Thank you for the love, Abhay. We wish to continue to evolve on our path to sustainability and safety.",en,[],[],https://twitter.com/volvocarsin/status/1509076723648057347,[],[],0,,1,0,0
251,1509076003054043146,volvocarsin,1648626731000.0,2022-03-30 15:52:11,@VickyGoelBharat Hi Vicky. Thank you for your interest in Volvo Car India. Please DM us your contact information and Team Volvo will get in touch with you soon.,en,[],[],https://twitter.com/volvocarsin/status/1509076003054043146,[],[],0,,0,2,0
252,1509075239359356929,volvocarsin,1648626548000.0,2022-03-30 15:49:08,"@TheeNormalOne We are sorry to hear that. Please DM us your contact information, and Team Volvo will get in touch with you soon.   Thank you for your patience.",en,[],[],https://twitter.com/volvocarsin/status/1509075239359356929,[],[],0,,0,0,0
253,1509074292860137475,volvocarsin,1648626323000.0,2022-03-30 15:45:23,"@Mindhunter_98 @DigitallyBones Thank you for the love, Ayush.",en,[],[],https://twitter.com/volvocarsin/status/1509074292860137475,[],[],0,,1,0,0
257,1509040537071980550,OlliLuksic,1648618275000.0,2022-03-30 13:31:15,"Chinese automotive group Geely, also parent of Volvo, has started a 15-month trial using green methanol e-fuel and methanol cars in Denmark.   https://t.co/80AC4x6pO5",en,[],[],https://twitter.com/OlliLuksic/status/1509040537071980550,['https://www.fleeteurope.com/en/new-energies/europe/features/geely-starts-e-fuel-trial-denmark?a=FJA05&curl=1'],[],0,,6,1,3
258,1509040245131595781,volvocarsin,1648618205000.0,2022-03-30 13:30:05,"Your new Volvo, with built-in Google services, reflects you, with all your favourite music and podcast apps available for your use.  Avail it with the petrol mild hybrid S90 and XC60.  #VolvoIndia #GoogleServices  https://t.co/guIN4gjaAw",en,"['volvoindia', 'googleservices']",[],https://twitter.com/volvocarsin/status/1509040245131595781,[],['https://pbs.twimg.com/media/FPEwGrVXoAk53X0.jpg'],1,https://pbs.twimg.com/media/FPEwGrVXoAk53X0.jpg,1557,28,170
259,1509033196930809859,ProfPCDoherty,1648616525000.0,2022-03-30 13:02:05,"@SkylarksRising I had a stick shift Saab 900 way back and, to quote Click and Clack the NPR Tappet brothers, it was a real 'Saab story'! It was 1 of the 2 least stolen cars in America..had to be in reverse to get the key out! Our other car was No2, a stick shift Volvo 240.",en,[],[],https://twitter.com/ProfPCDoherty/status/1509033196930809859,[],[],0,,2,2,1
260,1509023192819638275,thesportsGab,1648614140000.0,2022-03-30 12:22:20,@Volvo_Roger This is too relatable 😂😂,en,[],[],https://twitter.com/thesportsGab/status/1509023192819638275,[],[],0,,1,1,0
262,1509002781121777669,USNewsCars,1648609273000.0,2022-03-30 11:01:13,Volvo is charting a course for its future that's all-electric.  https://t.co/x7xx6ZOClv,en,[],[],https://twitter.com/USNewsCars/status/1509002781121777669,['https://nytv.to/8Bewl'],[],0,,1,0,0
266,1508968404690128908,phoebesaid,1648601077000.0,2022-03-30 08:44:37,Note: @Ford CEO @jimfarley98 discussed publicly the importance of software and having control over it nearly 3 weeks before the Volvo CEO.   https://t.co/fMbH026sF2,en,[],[],https://twitter.com/phoebesaid/status/1508968404690128908,['https://www.freep.com/story/money/cars/ford/2022/03/22/ford-ceo-farley-talent-goals/9453474002/'],[],0,,4,1,1
267,1508966979402620929,phoebesaid,1648600737000.0,2022-03-30 08:38:57,"Increasing the computing power of cars will be more difficult for the industry than switching to electric from combustion propulsion, @volvocars new CEO Jim Rowan said. He wants Volvo to be more in control of the software it develops, deploys.   https://t.co/VKJZ3Kex4b @freep",en,[],[],https://twitter.com/phoebesaid/status/1508966979402620929,['https://www.autonews.com/automakers-suppliers/volvos-new-boss-says-company-needs-get-smarter-about-software'],[],0,,3,1,1
268,1508962213532508171,Automotive_News,1648599601000.0,2022-03-30 08:20:01,"Volvo Cars needs to be more in control of the software it develops and deploys in its vehicles, the automaker’s new CEO said.  https://t.co/7Pn7Az78YX",en,[],[],https://twitter.com/Automotive_News/status/1508962213532508171,['http://ow.ly/X56o50IvBch'],[],0,,4,0,1
269,1508959096082419714,thedrive,1648598858000.0,2022-03-30 08:07:38,How this 2001 Volvo got stuck on a tiny island in a flooded strip mine:  https://t.co/nutMHa4Vht,en,[],[],https://twitter.com/thedrive/status/1508959096082419714,['https://www.thedrive.com/news/32975/how-this-2001-volvo-got-stuck-on-a-tiny-island-in-a-flooded-strip-mine'],[],0,,3,0,0
270,1508957608157360131,WLBT,1648598503000.0,2022-03-30 08:01:43,🚨JUST IN🚨 Mississippi Highway Patrol says 47-year-old Michael J. Wilson was traveling south in a 2018 Volvo tractor-trailer when the vehicle ran off the road and collided with several trees.  https://t.co/tUnOAuK0BL,en,[],[],https://twitter.com/WLBT/status/1508957608157360131,['https://www.wlbt.com/2022/03/29/gulfport-man-dies-after-crash-interstate-55-madison-county/?utm_source=twitter&utm_medium=social&utm_campaign=snd&utm_content=wlbt'],[],0,,1,0,1
272,1508949155569414147,Chas_Battery,1648596488000.0,2022-03-30 07:28:08,"@VolvoCarUSA @opencup The shirt takes inspiration from the topography design featured in the dashboard of the Volvo C40 Recharge, reinterpreted to depict Charleston's iconic coastline.  The orange accents are a nod to the ""high-visibility"" orange worn by employees at @VolvoCarUSA’s Charleston plant.  https://t.co/As0vQaVADV",en,[],[],https://twitter.com/Chas_Battery/status/1508949155569414147,[],"['https://pbs.twimg.com/media/FPDclYqXoAE6ys3.jpg', 'https://pbs.twimg.com/media/FPDcpkBXMAYqf-4.jpg']",1,https://pbs.twimg.com/media/FPDclYqXoAE6ys3.jpg,28,1,4
273,1508942440576823298,Chas_Battery,1648594887000.0,2022-03-30 07:01:27,"🆕 #CB93 ✖️ @VolvoCarUSA 👕  Introducing the 𝐑𝐞𝐜𝐡𝐚𝐫𝐠𝐞 𝐊𝐢𝐭, our third kit for 2022! 🗞️  https://t.co/xf8cRg4HFR  An exciting collaboration with Volvo Car USA, the new shirt will make its debut in our @opencup match next week!  https://t.co/xgLBHudabj",en,['cb93'],[],https://twitter.com/Chas_Battery/status/1508942440576823298,['https://bit.ly/3DoKJAZ'],[],1,https://pbs.twimg.com/media/FPDXJSjXIAIhhKS.jpg,46,2,15
274,1508937514521878534,KateOnKamera,1648593712000.0,2022-03-30 06:41:52,"Me, eight years old, in a car seat in the back of my moms Volvo, listening to the radio on the way to Hebrew school in 2005: “ALL THE GIRLS STOMP YOUR FEET LIKE THIS … ooooo this my SHHHHH this my SHHHHH”",en,[],[],https://twitter.com/KateOnKamera/status/1508937514521878534,[],[],0,,6,0,0
277,1508886734725124100,MickiMaynard,1648581605000.0,2022-03-30 03:20:05,There are three of these projects - Volvo is the only car company.  https://t.co/wSezut37u0,en,[],[],https://twitter.com/MickiMaynard/status/1508886734725124100,['https://www.progressiverailroading.com/federal_legislation_regulation/news/INFRA-grants-announced-for-rail-projects-in-three-states--63886'],[],0,,0,1,0
278,1508886731755593729,MickiMaynard,1648581605000.0,2022-03-30 03:20:05,It’s a $25 million federal grant to build a 23-mile rail line from the Volvo plant to the Port of Charleston. The @postandcourier has been reporting on this.,en,[],[],https://twitter.com/MickiMaynard/status/1508886731755593729,[],[],0,,1,1,0
279,1508881580294651908,VolvoTrucksUK,1648580377000.0,2022-03-30 02:59:37,"🔋⚡ A clean, quiet and powerful new electric driveline is central to our heavy-duty electric trucks. Here’s how it works. 👇   #drivingprogress #speedinguptheshift #electrictrucksinreality #volvotrucks #volvoelectric #electrictruck #sustainability #greentransport #BEV  https://t.co/NcPb6kA8oa",en,"['drivingprogress', 'speedinguptheshift', 'electrictrucksinreality', 'volvotrucks', 'volvoelectric', 'electrictruck', 'sustainability', 'greentransport', 'bev']",[],https://twitter.com/VolvoTrucksUK/status/1508881580294651908,[],[],1,https://pbs.twimg.com/ext_tw_video_thumb/1508881429903687685/pu/img/t5-vtbfrdUvPR2nS.jpg,21,1,5
283,1508846615154597902,InsideEVs,1648572040000.0,2022-03-30 00:40:40,US: Volvo Trucks Receives Record Orders For VNR Electric Trucks  https://t.co/lRsD0gyf3W via @insideevs.com,en,[],[],https://twitter.com/InsideEVs/status/1508846615154597902,['https://insideevs.com/news/576585/us-volvo-vnr-electric-orders/amp/'],[],0,,24,1,13
284,1508845459430907915,TriBizTech,1648571765000.0,2022-03-30 00:36:05,"And who can forget the sting of Volvo back in 2015? If - as expected - a carmaker announces an assembly plant in North Carolina this week, it's literally years in the making for state recruiters.  https://t.co/bDvBTrLOb2",en,[],[],https://twitter.com/TriBizTech/status/1508845459430907915,['https://www.bizjournals.com/triangle/blog/real-estate/2015/04/with-incentives-bill-still-pending-n-c-likely.html'],[],0,,0,0,0
285,1508843988127817734,TriBizTech,1648571414000.0,2022-03-30 00:30:14,"Those of you following the ecodevo saga in North Carolina with me won't be surprised to know we've been waiting on this headline awhile. There was Volvo, Mercedes, Toyota, Ford, Rivian, Tesla, ElectraMeccanica...  https://t.co/I30gzVMu8O",en,[],[],https://twitter.com/TriBizTech/status/1508843988127817734,['https://www.bizjournals.com/triangle/news/2022/03/28/carmaker-eyeing-chatham-co-could-spark-more-growth.html'],[],0,,1,0,0
287,1508835791489110018,JesseThorn,1648569460000.0,2022-03-29 23:57:40,@martinperna Yeah this is the answer. Going to the auto glass district and ordering something that says VOLVO SUPER SPORT WAGON,en,[],[],https://twitter.com/JesseThorn/status/1508835791489110018,[],[],0,,6,1,0
288,1508831381912236042,business,1648568408000.0,2022-03-29 23:40:08,Volvo's new boss believes boosting the computing power of cars will be more challenging and transformative for the industry than going electric  https://t.co/vHcO4KvNJQ,en,[],[],https://twitter.com/business/status/1508831381912236042,['https://trib.al/UqrXOWB'],[],0,,24,5,5
289,1508830780188987404,VolvoCarUSA,1648568265000.0,2022-03-29 23:37:45,"@chrissieTampa Hi Chris, we're sorry to hear this. Our Customer Care team would be happy to look into this further. Could you send us a DM with your email address and VIN?",en,[],[],https://twitter.com/VolvoCarUSA/status/1508830780188987404,[],[],0,,0,2,0
290,1508830615910731780,technology,1648568226000.0,2022-03-29 23:37:06,Volvo's new boss believes boosting the computing power of cars will be more challenging and transformative for the industry than going electric  https://t.co/wR0zx2Fp3i,en,[],[],https://twitter.com/technology/status/1508830615910731780,['https://trib.al/M5wwknl'],[],0,,7,0,3
292,1508813619215179796,Automotive_News,1648564173000.0,2022-03-29 22:29:33,Volvo's new boss says the company needs to get smarter about software  https://t.co/gYPyVQWzxf  https://t.co/AaEqEqXSio,en,[],[],https://twitter.com/Automotive_News/status/1508813619215179796,['http://dlvr.it/SMZrB4'],['https://pbs.twimg.com/media/FPBh_a7XwAMdnqE.jpg'],1,https://pbs.twimg.com/media/FPBh_a7XwAMdnqE.jpg,3,0,1
293,1508810227877089289,AutoNewsEurope,1648563365000.0,2022-03-29 22:16:05,Volvo's new CEO says automaker must be smarter on software  https://t.co/gVfXVSn0EB  https://t.co/v4DI8hX1Es,en,[],[],https://twitter.com/AutoNewsEurope/status/1508810227877089289,['http://dlvr.it/SMZnh2'],['https://pbs.twimg.com/media/FPBe6A9XEBAVNac.jpg'],1,https://pbs.twimg.com/media/FPBe6A9XEBAVNac.jpg,0,0,1
294,1508807961149423626,VolvoCarUSA,1648562824000.0,2022-03-29 22:07:04,@_ItsKilooo We would be happy to look into this further. Could you send us a DM with your email address and VIN?,en,[],[],https://twitter.com/VolvoCarUSA/status/1508807961149423626,[],[],0,,0,0,0
295,1508805123245547524,VolvoCarUSA,1648562148000.0,2022-03-29 21:55:48,"@_ItsKilooo Hi, we've sent you a message. Please check your inbox!",en,[],[],https://twitter.com/VolvoCarUSA/status/1508805123245547524,[],[],0,,0,1,0
299,1508783543329173506,VolvoTrucksUK,1648557003000.0,2022-03-29 20:30:03,Global Logistics company @Maersk places the largest Volvo VNR Electric truck order to-date!  A record 110 electric trucks have been ordered from Volvo Trucks in North America🔋   Read the full story▶️  https://t.co/m2ktzP5zhz  #speedinguptheshift #electrictrucks  https://t.co/DIjU949MjN,en,"['speedinguptheshift', 'electrictrucks']",[],https://twitter.com/VolvoTrucksUK/status/1508783543329173506,['https://bit.ly/36Sywsf'],['https://pbs.twimg.com/media/FPBGogoXEAIqExJ.jpg'],1,https://pbs.twimg.com/media/FPBGogoXEAIqExJ.jpg,23,1,4
300,1508777240804442118,AOC_Gaming,1648555500000.0,2022-03-29 20:05:00,@niceAbyss @PolestarCars Love those! Huge volvo fan,en,[],[],https://twitter.com/AOC_Gaming/status/1508777240804442118,[],[],0,,1,1,0
301,1508771159453540355,NBKPage,1648554050000.0,2022-03-29 19:40:50,"There is no better time for you to buy a new car. Purchase a Volvo S60, S90, XC40 T4 or XC90 T6 car and get 0% interest for 5 years offered by BNK Automotive. Hurry and take advantage of this limited time offer today. 🚘 T&amp;C apply.  https://t.co/xZi3hN5glg  https://t.co/bkUXgxsr6x",en,[],[],https://twitter.com/NBKPage/status/1508771159453540355,['http://nbk.com/volvo'],['https://pbs.twimg.com/media/FPA7XyaVcAAXrdm.jpg'],1,https://pbs.twimg.com/media/FPA7XyaVcAAXrdm.jpg,6,1,0
302,1508763553792073728,JesseThorn,1648552237000.0,2022-03-29 19:10:37,"@MatRicardo Come back to LA and we can eat them in my Volvo in an underground supermarket parking lot like @benpartridge and I did when he visited, only you won’t whine like Ben did that it isn’t a sufficiently premium chocolate because you’re not a whiny European ice cream bar baby.",en,[],[],https://twitter.com/JesseThorn/status/1508763553792073728,[],[],0,,2,1,0
304,1508732376385474567,SoozUK,1648544804000.0,2022-03-29 17:06:44,Gregory XIII was the first man on the street to own a Volvo estate and in the summer if you walked past while he was washing it (which he did every weekend) he'd pretend he was going to spray you with the hose.  https://t.co/c6N5uuLSfW,en,[],[],https://twitter.com/SoozUK/status/1508732376385474567,[],['https://pbs.twimg.com/media/FPAVp3KWUAciy5A.png'],1,https://pbs.twimg.com/media/FPAVp3KWUAciy5A.png,38,1,2
306,1508713967187001348,CarWale,1648540414000.0,2022-03-29 15:53:34,"The Volvo S60 is a stylish and spacious sedan with a great interior and lots of hi-tech features. It's a fast sedan, quite practical, good to drive, packed with features, and has got your back with all its safety tech.  #CWSnippet #VolvoS60 #VolvoCars #Volvo #cars2022 #Carlife  https://t.co/tkMFM9HVbc",en,"['cwsnippet', 'volvos60', 'volvocars', 'volvo', 'cars2022', 'carlife']",[],https://twitter.com/CarWale/status/1508713967187001348,[],[],1,https://pbs.twimg.com/ext_tw_video_thumb/1508713904800931843/pu/img/MChVhOrgs31TQUCF.jpg,5,0,1
307,1508713585026891785,alechogg,1648540323000.0,2022-03-29 15:52:03,Volvo XC40 Recharge P8: an electrified crossover SUV that makes sense  https://t.co/tP0SXmnh8o  https://t.co/htHieDAfS0,en,[],[],https://twitter.com/alechogg/status/1508713585026891785,['https://www.biznews.com/motoring/2022/03/29/volvo-xc40-recharge-p8-electrified?utm_source=dlvr.it&utm_medium=twitter'],['https://pbs.twimg.com/media/FPAHAq_VUAMMj9m.jpg'],1,https://pbs.twimg.com/media/FPAHAq_VUAMMj9m.jpg,1,0,0
308,1508700507572998145,VolvoTrucksUK,1648537205000.0,2022-03-29 15:00:05,"Featured in this month's @TrucknDriver, we let @dougierankine put the latest Volvo #FH16 750 to the test!✅    ""Fully loaded and in torrential rain, this is where the Volvo really comes into its own...""  ⭐Pick up a copy of T&amp;D to get the final verdict!   #VolvoTrucks #volvofh16  https://t.co/igZd9S8MUH",en,"['fh16', 'volvotrucks', 'volvofh16']",[],https://twitter.com/VolvoTrucksUK/status/1508700507572998145,[],"['https://pbs.twimg.com/media/FO_7G-oXwAUE7ti.jpg', 'https://pbs.twimg.com/media/FO_7HHTWYAcSDdz.jpg', 'https://pbs.twimg.com/media/FO_7HRCX0AUGdII.jpg', 'https://pbs.twimg.com/media/FO_7HcNXMAgWHsp.jpg']",1,https://pbs.twimg.com/media/FO_7G-oXwAUE7ti.jpg,80,1,12
310,1508682989479546885,sidpatankar,1648533029000.0,2022-03-29 13:50:29,All set to drive this red hot green car! All new Volvo #XC40Recharge  SVP   #xc #volvoxc #ev #electric #pushtoplugin #volvoev #fjordblue #compact #crossover #coupe #xc40 #suv #greencar #anticipation #iloveelectric #twotone #electricmobility  https://t.co/plaf2UtJF9,en,"['xc40recharge', 'xc', 'volvoxc', 'ev', 'electric', 'pushtoplugin', 'volvoev', 'fjordblue', 'compact', 'crossover', 'coupe', 'xc40', 'suv', 'greencar', 'anticipation', 'iloveelectric', 'twotone', 'electricmobility']",[],https://twitter.com/sidpatankar/status/1508682989479546885,[],"['https://pbs.twimg.com/media/FO_rLCUWUAI7kdB.jpg', 'https://pbs.twimg.com/media/FO_rLCXWUAITWlQ.jpg']",1,https://pbs.twimg.com/media/FO_rLCUWUAI7kdB.jpg,29,2,2
311,1508682177826938883,volvocars,1648532835000.0,2022-03-29 13:47:15,"@zenindia Hello, we have sent you a message, please check your inbox.",en,[],[],https://twitter.com/volvocars/status/1508682177826938883,[],[],0,,0,1,0
312,1508677855689027586,volvocarsin,1648531805000.0,2022-03-29 13:30:05,The new Volvo S90 petrol with mild hybrid technology offers top of the class luxury features so you always ride in comfort.   Find out more :  https://t.co/6OQuE4tUAW  #VolvoIndia #S90  https://t.co/UFAu5aar52,en,"['volvoindia', 's90']",[],https://twitter.com/volvocarsin/status/1508677855689027586,['https://bit.ly/3uzPvHV'],['https://pbs.twimg.com/media/FO_mg0-XwAQFKfs.jpg'],1,https://pbs.twimg.com/media/FO_mg0-XwAQFKfs.jpg,4218,45,279
313,1508664791539535875,sidpatankar,1648528690000.0,2022-03-29 12:38:10,Drove the #Volvo #C40Recharge few days ago &amp; loved it. My exclusive review:  https://t.co/zV1Bv9zyVh. Relevant as it’s mechanically identical to the #XC40Recharge that’s launching in India! I hope it comes in this gorgeous fjord blue paint shade! SVP   #ev #electric #pushtoplugin  https://t.co/NOXFKNBQq9,en,"['volvo', 'c40recharge', 'xc40recharge', 'ev', 'electric', 'pushtoplugin']",[],https://twitter.com/sidpatankar/status/1508664791539535875,['https://youtu.be/wopJl6rqBKI'],['https://pbs.twimg.com/media/FO_an_8aIAIcXMF.jpg'],1,https://pbs.twimg.com/media/FO_an_8aIAIcXMF.jpg,39,6,5
318,1508595067547795460,adsoftheworld,1648512067000.0,2022-03-29 08:01:07,"Get to know more about the Volvo ad by Grey Brazil and Grey NY, Brazil: Every electric socket in the World  https://t.co/hviQ95fkB2  https://t.co/GRuLPJPrK3",en,[],[],https://twitter.com/adsoftheworld/status/1508595067547795460,['https://bit.ly/3tMMO6U'],['https://pbs.twimg.com/media/FO-bN-CXoA0ukON.jpg'],1,https://pbs.twimg.com/media/FO-bN-CXoA0ukON.jpg,1,0,0
320,1508575981434552327,CsgoHades,1648507516000.0,2022-03-29 06:45:16,Volvo updating new maps? - vertigo when  https://t.co/5EsFBEEPeE,en,[],[],https://twitter.com/CsgoHades/status/1508575981434552327,[],['https://pbs.twimg.com/media/FO-J2RwWQAAs0xe.png'],1,https://pbs.twimg.com/media/FO-J2RwWQAAs0xe.png,271,13,2
322,1508525014106218504,roadshow,1648495365000.0,2022-03-29 03:22:45,"In an exclusive interview, the former Volvo CEO looks back on his decade-long tenure with the Swedish automaker  https://t.co/e1rOCY0HeE",en,[],[],https://twitter.com/roadshow/status/1508525014106218504,['https://trib.al/2k1S2Sm'],[],0,,1,0,0
